Sheet: Factions
B1: Imperium | C1: Stellarion | D1: Rogue Alliance | E1: Bot Brigade | F1: Weight
A2: Reward | B2: 2 | C2: 3 | D2: 1 | E2: 1 | F2: 1 | G2: of:=[.B2]*[.$F2] -> 2 | H2: of:=[.C2]*[.$F2] -> 3 | I2: of:=[.D2]*[.$F2] -> 1 | J2: of:=[.E2]*[.$F2] -> 1
A3: Energy Loss | B3: 3 | C3: 3 | D3: 1 | E3: 2 | F3: -0.25 | G3: of:=[.B3]*[.$F3] -> -0.75 | H3: of:=[.C3]*[.$F3] -> -0.75 | I3: of:=[.D3]*[.$F3] -> -0.25 | J3: of:=[.E3]*[.$F3] -> -0.5
A4: Credit Gain | B4: 1 | C4: 4 | D4: 2 | E4: 2 | F4: 0.65 | G4: of:=[.B4]*[.$F4] -> 0.65 | H4: of:=[.C4]*[.$F4] -> 2.6 | I4: of:=[.D4]*[.$F4] -> 1.3 | J4: of:=[.E4]*[.$F4] -> 1.3
A5: Strength Gain | B5: 4 | C5: 1 | D5: 2 | E5: 2 | F5: 0.75 | G5: of:=[.B5]*[.$F5] -> 3 | H5: of:=[.C5]*[.$F5] -> 0.75 | I5: of:=[.D5]*[.$F5] -> 1.5 | J5: of:=[.E5]*[.$F5] -> 1.5
A6: Energy Gain | B6: 2 | C6: 3 | D6: 1 | E6: 4 | F6: 0.33 | G6: of:=[.B6]*[.$F6] -> 0.66 | H6: of:=[.C6]*[.$F6] -> 0.99 | I6: of:=[.D6]*[.$F6] -> 0.33 | J6: of:=[.E6]*[.$F6] -> 1.32
A7: Planet Heal | B7: 0 | C7: 1 | D7: 0 | E7: 0 | F7: 0.4 | G7: of:=[.B7]*[.$F7] -> 0 | H7: of:=[.C7]*[.$F7] -> 0.4 | I7: of:=[.D7]*[.$F7] -> 0 | J7: of:=[.E7]*[.$F7] -> 0
A8: Shield Health | B8: 3 | C8: 4 | D8: 1 | E8: 2 | F8: 0.5 | G8: of:=[.B8]*[.$F8] -> 1.5 | H8: of:=[.C8]*[.$F8] -> 2 | I8: of:=[.D8]*[.$F8] -> 0.5 | J8: of:=[.E8]*[.$F8] -> 1
A9: Retain? | B9: 1 | C9: 2 | D9: 3 | E9: 1 | F9: 0.25 | G9: of:=[.B9]*[.$F9] -> 0.25 | H9: of:=[.C9]*[.$F9] -> 0.5 | I9: of:=[.D9]*[.$F9] -> 0.75 | J9: of:=[.E9]*[.$F9] -> 0.25
A10: Scrap X | B10: 1 | C10: 1 | D10: 3 | E10: 2 | F10: 0.6 | G10: of:=[.B10]*[.$F10] -> 0.6 | H10: of:=[.C10]*[.$F10] -> 0.6 | I10: of:=[.D10]*[.$F10] -> 1.8 | J10: of:=[.E10]*[.$F10] -> 1.2
A11: Draw X | B11: 2 | C11: 1 | D11: 2 | E11: 4 | F11: 0.75 | G11: of:=[.B11]*[.$F11] -> 1.5 | H11: of:=[.C11]*[.$F11] -> 0.75 | I11: of:=[.D11]*[.$F11] -> 1.5 | J11: of:=[.E11]*[.$F11] -> 3
A12: Fleets | B12: 3 | C12: 3 | D12: 2 | E12: 1 | F12: 0 | G12: of:=[.B12]*[.$F12] -> 0 | H12: of:=[.C12]*[.$F12] -> 0 | I12: of:=[.D12]*[.$F12] -> 0 | J12: of:=[.E12]*[.$F12] -> 0
A13: Transforms? | B13: 4 | C13: 3 | D13: 1 | E13: 2 | F13: 0.33 | G13: of:=[.B13]*[.$F13] -> 1.32 | H13: of:=[.C13]*[.$F13] -> 0.99 | I13: of:=[.D13]*[.$F13] -> 0.33 | J13: of:=[.E13]*[.$F13] -> 0.66
A14: Pierce? | B14: 1 | C14: 0 | D14: 0 | E14: 0 | F14: 0.2 | G14: of:=[.B14]*[.$F14] -> 0.2 | H14: of:=[.C14]*[.$F14] -> 0 | I14: of:=[.D14]*[.$F14] -> 0 | J14: of:=[.E14]*[.$F14] -> 0
A15: Empower? | B15: 2 | C15: 1 | D15: 3 | E15: 2 | F15: of:=[.F11]+0.25 -> 1 | G15: of:=[.B15]*[.$F15] -> 2 | H15: of:=[.C15]*[.$F15] -> 1 | I15: of:=[.D15]*[.$F15] -> 3 | J15: of:=[.E15]*[.$F15] -> 2
A16: X or Y? | B16: 0 | C16: 0 | D16: 3 | E16: 1 | F16: 0.25 | G16: of:=[.B16]*[.$F16] -> 0 | H16: of:=[.C16]*[.$F16] -> 0 | I16: of:=[.D16]*[.$F16] -> 0.75 | J16: of:=[.E16]*[.$F16] -> 0.25
A17: Ally? | B17: 2 | C17: 1 | D17: 3 | E17: 4 | F17: 0.2 | G17: of:=[.B17]*[.$F17] -> 0.4 | H17: of:=[.C17]*[.$F17] -> 0.2 | I17: of:=[.D17]*[.$F17] -> 0.6 | J17: of:=[.E17]*[.$F17] -> 0.8
A18: Sum | B18: of:=SUM([.B2:.B17])-[.B3]*2 -> 25 | C18: of:=SUM([.C2:.C17])-[.C3]*2 -> 25 | D18: of:=SUM([.D2:.D17])-[.D3]*2 -> 26 | E18: of:=SUM([.E2:.E17])-[.E3]*2 -> 26 | G18: of:=SUM([.G2:.G17]) -> 13.33 | H18: of:=SUM([.H2:.H17]) -> 13.03 | I18: of:=SUM([.I2:.I17]) -> 13.11 | J18: of:=SUM([.J2:.J17]) -> 13.78

Sheet: Cards & Planets
A1: Name | B1: Faction | C1: Kind | D1: Sub-kind | E1: Text | F1: Trade Cost | G1: Strength Cost | H1: Anima Cost | I1: Favor | J1: Anima Loss | K1: Trade Gain | L1: Strength Gain | M1: Permanent Anima Gain | N1: Anima Gain | O1: Favor Gain | P1: Heal | Q1: Health | R1: Expected #X Anima Ability? | S1: Scrap X Discard | T1: Scrap X | U1: Draw X | V1: Discard Y | W1: Upgrade Anima Cost | X1: Pierce? | Y1: Empower? | Z1: X or Y? | AA1: Trash? | AB1: Ally? | AC1: God Favor Schedule | AD1: Additional Effects Weight | AE1: Sum | AF1: Net Gain | AG1: Total Value | AH1: Flavor Text | AI1: Notes | AJ1: Card Count | AK1: Show Card Count | AL1: Generate Card? | AM1: Row Number
A2: Trader | B2: U | C2: Human | E2: Gain 1 Trade | K2: 1 | AE2: of:=IF([.W2]>0;[.AO$7]*[.W2];0)+IF([.W2]>0;[.AO$19];1)*IF([.R2]>0;[.R2];1)*IF([.AB2]=1;[.AB2]*[.AO$26];1)*(IF([.Z2]>0;[.AO$22];1)*([.J2]*[.AO$7]+[.K2]*[.AO$8]+[.L2]*[.AO$9]+[.N2]*[.AO$10]+[.O2]*[.AO$12]+[.P2]*[.AO$13]+[.S2]*[.AO$15]+[.T2]*[.AO$16]+[.U2]*[.AO$17]+[.V2]*[.AO$18]+[.X2]*[.AO$20])+[.Q2]*[.AO$14]+[.Y2]*[.AO$21]+[.AD2]*[.AO$27]) -> 1 | AF2: of:=[.AE2]+[.I2]-IF([.W2]>0;0;[.F2]+[.G2]+[.H2]) -> 1 | AG2: of:=[.AF2] -> 1 | AJ2: of:=4*6 -> 24 | AL2: 1 | AM2: 1 | AN2: Do not drag formulas in Total Value col
A3: Supplier | B3: U | C3: Human | E3: Gain 1 Trade or Garrison to gain 2 Trade | F3: 3 | I3: 1 | K3: 1 | AE3: of:=IF([.W3]>0;[.AO$7]*[.W3];0)+IF([.W3]>0;[.AO$19];1)*IF([.R3]>0;[.R3];1)*IF([.AB3]=1;[.AB3]*[.AO$26];1)*(IF([.Z3]>0;[.AO$22];1)*([.J3]*[.AO$7]+[.K3]*[.AO$8]+[.L3]*[.AO$9]+[.N3]*[.AO$10]+[.O3]*[.AO$12]+[.P3]*[.AO$13]+[.S3]*[.AO$15]+[.T3]*[.AO$16]+[.U3]*[.AO$17]+[.V3]*[.AO$18]+[.X3]*[.AO$20])+[.Q3]*[.AO$14]+[.Y3]*[.AO$21]+[.AD3]*[.AO$27]) -> 1 | AF3: of:=[.AE3]+[.I3]-IF([.W3]>0;0;[.F3]+[.G3]+[.H3]) -> -1 | AG3: of:=[.AF3] -> -1 | AJ3: of:=4+5*4 -> 24 | AL3: 1 | AM3: 2 | AN3: Weightings
A4: Infantry | B4: U | C4: Human | D4: Soldier | E4: Gain 2 Strength or Garrison to gain 3 Strength | L4: 2 | AE4: of:=IF([.W4]>0;[.AO$7]*[.W4];0)+IF([.W4]>0;[.AO$19];1)*IF([.R4]>0;[.R4];1)*IF([.AB4]=1;[.AB4]*[.AO$26];1)*(IF([.Z4]>0;[.AO$22];1)*([.J4]*[.AO$7]+[.K4]*[.AO$8]+[.L4]*[.AO$9]+[.N4]*[.AO$10]+[.O4]*[.AO$12]+[.P4]*[.AO$13]+[.S4]*[.AO$15]+[.T4]*[.AO$16]+[.U4]*[.AO$17]+[.V4]*[.AO$18]+[.X4]*[.AO$20])+[.Q4]*[.AO$14]+[.Y4]*[.AO$21]+[.AD4]*[.AO$27]) -> 2 | AF4: of:=[.AE4]+[.I4]-IF([.W4]>0;0;[.F4]+[.G4]+[.H4]) -> 2 | AG4: of:=[.AF4] -> 2 | AJ4: 4 | AL4: 1 | AM4: 3 | AN4: Trade Cost | AO4: 0
A5: Guard | B5: U | C5: Human | D5: Guard | E5: Gain 1 Strength or Garrison to gain 2 Strength | F5: 2 | I5: 1 | L5: 1 | AE5: of:=IF([.W5]>0;[.AO$7]*[.W5];0)+IF([.W5]>0;[.AO$19];1)*IF([.R5]>0;[.R5];1)*IF([.AB5]=1;[.AB5]*[.AO$26];1)*(IF([.Z5]>0;[.AO$22];1)*([.J5]*[.AO$7]+[.K5]*[.AO$8]+[.L5]*[.AO$9]+[.N5]*[.AO$10]+[.O5]*[.AO$12]+[.P5]*[.AO$13]+[.S5]*[.AO$15]+[.T5]*[.AO$16]+[.U5]*[.AO$17]+[.V5]*[.AO$18]+[.X5]*[.AO$20])+[.Q5]*[.AO$14]+[.Y5]*[.AO$21]+[.AD5]*[.AO$27]) -> 1 | AF5: of:=[.AE5]+[.I5]-IF([.W5]>0;0;[.F5]+[.G5]+[.H5]) -> 0 | AG5: of:=[.AF5] -> 0 | AJ5: of:=4+5*4 -> 24 | AL5: 1 | AM5: 4 | AN5: Strength Cost | AO5: 0
A6: Mage | B6: U | C6: Human | D6: Animist | E6: Gain 2 Anima | F6: 3 | I6: 1 | N6: 2 | AE6: of:=IF([.W6]>0;[.AO$7]*[.W6];0)+IF([.W6]>0;[.AO$19];1)*IF([.R6]>0;[.R6];1)*IF([.AB6]=1;[.AB6]*[.AO$26];1)*(IF([.Z6]>0;[.AO$22];1)*([.J6]*[.AO$7]+[.K6]*[.AO$8]+[.L6]*[.AO$9]+[.N6]*[.AO$10]+[.O6]*[.AO$12]+[.P6]*[.AO$13]+[.S6]*[.AO$15]+[.T6]*[.AO$16]+[.U6]*[.AO$17]+[.V6]*[.AO$18]+[.X6]*[.AO$20])+[.Q6]*[.AO$14]+[.Y6]*[.AO$21]+[.AD6]*[.AO$27]) -> 2 | AF6: of:=[.AE6]+[.I6]-IF([.W6]>0;0;[.F6]+[.G6]+[.H6]) -> 0 | AG6: of:=[.AF6] -> 0 | AJ6: of:=4+5*4 -> 24 | AL6: 1 | AM6: 5 | AN6: Favor | AO6: 1
A7: Mud Wall | B7: U | C7: Fortification | E7: Draw 1 card. You may attach this to any Settlement you control 2 Health | Q7: 2 | U7: 1 | AE7: of:=IF([.W7]>0;[.AO$7]*[.W7];0)+IF([.W7]>0;[.AO$19];1)*IF([.R7]>0;[.R7];1)*IF([.AB7]=1;[.AB7]*[.AO$26];1)*(IF([.Z7]>0;[.AO$22];1)*([.J7]*[.AO$7]+[.K7]*[.AO$8]+[.L7]*[.AO$9]+[.N7]*[.AO$10]+[.O7]*[.AO$12]+[.P7]*[.AO$13]+[.S7]*[.AO$15]+[.T7]*[.AO$16]+[.U7]*[.AO$17]+[.V7]*[.AO$18]+[.X7]*[.AO$20])+[.Q7]*[.AO$14]+[.Y7]*[.AO$21]+[.AD7]*[.AO$27]) -> 1.6 | AF7: of:=[.AE7]+[.I7]-IF([.W7]>0;0;[.F7]+[.G7]+[.H7]) -> 1.6 | AG7: of:=[.AF7] -> 1.6 | AJ7: 4 | AL7: 1 | AM7: 6 | AN7: Anima Loss | AO7: -0.5
A8: Jump Cruiser | B8: NA | C8: Human | E8: Pay 1 Anima to gain 1 Strength. Upgrade: You may pay 1 Anima to upgrade this into Jump Fighter | F8: 1 | I8: of:=CEILING([.F8]/2;1) -> 1 | J8: 1 | L8: 1 | AE8: of:=IF([.W8]>0;[.AO$7]*[.W8];0)+IF([.W8]>0;[.AO$19];1)*IF([.R8]>0;[.R8];1)*IF([.AB8]=1;[.AB8]*[.AO$26];1)*(IF([.Z8]>0;[.AO$22];1)*([.J8]*[.AO$7]+[.K8]*[.AO$8]+[.L8]*[.AO$9]+[.N8]*[.AO$10]+[.O8]*[.AO$12]+[.P8]*[.AO$13]+[.S8]*[.AO$15]+[.T8]*[.AO$16]+[.U8]*[.AO$17]+[.V8]*[.AO$18]+[.X8]*[.AO$20])+[.Q8]*[.AO$14]+[.Y8]*[.AO$21]+[.AD8]*[.AO$27]) -> 0.5 | AF8: of:=[.AE8]+[.I8]-IF([.W8]>0;0;[.F8]+[.G8]+[.H8]) -> 0.5 | AG8: of:=[.AF8]+[.AF9] -> 2.25 | AJ8: of:=IF([.F8]<5; 3; IF([.F8]<7; 2; 1)) -> 3 | AK8: 1 | AL8: 1 | AM8: 7 | AN8: Trade Gain | AO8: 1
A9: Upgrade: Jump Fighter | B9: NA | C9: Human | E9: Pay 1 Anima to gain 3 Strength | I9: 1 | J9: 1 | L9: 3 | W9: 1 | AE9: of:=IF([.W9]>0;[.AO$7]*[.W9];0)+IF([.W9]>0;[.AO$19];1)*IF([.R9]>0;[.R9];1)*IF([.AB9]=1;[.AB9]*[.AO$26];1)*(IF([.Z9]>0;[.AO$22];1)*([.J9]*[.AO$7]+[.K9]*[.AO$8]+[.L9]*[.AO$9]+[.N9]*[.AO$10]+[.O9]*[.AO$12]+[.P9]*[.AO$13]+[.S9]*[.AO$15]+[.T9]*[.AO$16]+[.U9]*[.AO$17]+[.V9]*[.AO$18]+[.X9]*[.AO$20])+[.Q9]*[.AO$14]+[.Y9]*[.AO$21]+[.AD9]*[.AO$27]) -> 0.75 | AF9: of:=[.AE9]+[.I9]-IF([.W9]>0;0;[.F9]+[.G9]+[.H9]) -> 1.75 | AJ9: of:=IF([.F9]<5; 3; IF([.F9]<7; 2; 1)) -> 3 | AK9: 1 | AM9: 8 | AN9: Strength Gain | AO9: 1
A10: Lancer | B10: NA | C10: Human | E10: Pay 1 Anima to gain 2 Strength | F10: 2 | I10: of:=CEILING([.F10]/2;1) -> 1 | J10: 1 | L10: 2 | X10: 1 | AE10: of:=IF([.W10]>0;[.AO$7]*[.W10];0)+IF([.W10]>0;[.AO$19];1)*IF([.R10]>0;[.R10];1)*IF([.AB10]=1;[.AB10]*[.AO$26];1)*(IF([.Z10]>0;[.AO$22];1)*([.J10]*[.AO$7]+[.K10]*[.AO$8]+[.L10]*[.AO$9]+[.N10]*[.AO$10]+[.O10]*[.AO$12]+[.P10]*[.AO$13]+[.S10]*[.AO$15]+[.T10]*[.AO$16]+[.U10]*[.AO$17]+[.V10]*[.AO$18]+[.X10]*[.AO$20])+[.Q10]*[.AO$14]+[.Y10]*[.AO$21]+[.AD10]*[.AO$27]) -> 1.7 | AF10: of:=[.AE10]+[.I10]-IF([.W10]>0;0;[.F10]+[.G10]+[.H10]) -> 0.7 | AG10: of:=[.AF10]+[.AF11]+[.AF12] -> 4.1 | AJ10: of:=IF([.F10]<5; 3; IF([.F10]<7; 2; 1)) -> 3 | AK10: 1 | AL10: 1 | AM10: 9 | AN10: Anima Gain | AO10: 1
A11: Ally | B11: NA | C11: Ability | E11: Gain 1 Trade | K11: 1 | AB11: 1 | AE11: of:=IF([.W11]>0;[.AO$7]*[.W11];0)+IF([.W11]>0;[.AO$19];1)*IF([.R11]>0;[.R11];1)*IF([.AB11]=1;[.AB11]*[.AO$26];1)*(IF([.Z11]>0;[.AO$22];1)*([.J11]*[.AO$7]+[.K11]*[.AO$8]+[.L11]*[.AO$9]+[.N11]*[.AO$10]+[.O11]*[.AO$12]+[.P11]*[.AO$13]+[.S11]*[.AO$15]+[.T11]*[.AO$16]+[.U11]*[.AO$17]+[.V11]*[.AO$18]+[.X11]*[.AO$20])+[.Q11]*[.AO$14]+[.Y11]*[.AO$21]+[.AD11]*[.AO$27]) -> 0.4 | AF11: of:=[.AE11]+[.I11]-IF([.W11]>0;0;[.F11]+[.G11]+[.H11]) -> 0.4 | AM11: 10 | AN11: Favor Gain | AO11: 2
A12: Trash | B12: NA | C12: Ability | E12: Gain 2 Strength and 1 Anima | L12: 2 | N12: 1 | AA12: 1 | AE12: of:=IF([.W12]>0;[.AO$7]*[.W12];0)+IF([.W12]>0;[.AO$19];1)*IF([.R12]>0;[.R12];1)*IF([.AB12]=1;[.AB12]*[.AO$26];1)*(IF([.Z12]>0;[.AO$22];1)*([.J12]*[.AO$7]+[.K12]*[.AO$8]+[.L12]*[.AO$9]+[.N12]*[.AO$10]+[.O12]*[.AO$12]+[.P12]*[.AO$13]+[.S12]*[.AO$15]+[.T12]*[.AO$16]+[.U12]*[.AO$17]+[.V12]*[.AO$18]+[.X12]*[.AO$20])+[.Q12]*[.AO$14]+[.Y12]*[.AO$21]+[.AD12]*[.AO$27]) -> 3 | AF12: of:=[.AE12]+[.I12]-IF([.W12]>0;0;[.F12]+[.G12]+[.H12]) -> 3 | AM12: 11 | AN12: Fortification Health | AO12: 0.4
A13: Radon Torpedo Cruiser | B13: NA | C13: Human | F13: 3 | I13: of:=CEILING([.F13]/2;1) -> 2 | AE13: of:=IF([.W13]>0;[.AO$7]*[.W13];0)+IF([.W13]>0;[.AO$19];1)*IF([.R13]>0;[.R13];1)*IF([.AB13]=1;[.AB13]*[.AO$26];1)*(IF([.Z13]>0;[.AO$22];1)*([.J13]*[.AO$7]+[.K13]*[.AO$8]+[.L13]*[.AO$9]+[.N13]*[.AO$10]+[.O13]*[.AO$12]+[.P13]*[.AO$13]+[.S13]*[.AO$15]+[.T13]*[.AO$16]+[.U13]*[.AO$17]+[.V13]*[.AO$18]+[.X13]*[.AO$20])+[.Q13]*[.AO$14]+[.Y13]*[.AO$21]+[.AD13]*[.AO$27]) -> 0 | AF13: of:=[.AE13]+[.I13]-IF([.W13]>0;0;[.F13]+[.G13]+[.H13]) -> -1 | AG13: of:=[.AF13] -> -1 | AJ13: of:=IF([.F13]<5; 3; IF([.F13]<7; 2; 1)) -> 3 | AK13: 1 | AL13: 1 | AM13: 12 | AN13: Heal | AO13: 0.5
A14: Stone Wall | B14: NA | C14: Fortification | E14: Draw 1 card. You may attach this to any Settlement you control | F14: 4 | I14: of:=CEILING([.F14]/2;1) -> 2 | J14: 1 | L14: 1 | Q14: 5 | U14: 1 | AE14: of:=IF([.W14]>0;[.AO$7]*[.W14];0)+IF([.W14]>0;[.AO$19];1)*IF([.R14]>0;[.R14];1)*IF([.AB14]=1;[.AB14]*[.AO$26];1)*(IF([.Z14]>0;[.AO$22];1)*([.J14]*[.AO$7]+[.K14]*[.AO$8]+[.L14]*[.AO$9]+[.N14]*[.AO$10]+[.O14]*[.AO$12]+[.P14]*[.AO$13]+[.S14]*[.AO$15]+[.T14]*[.AO$16]+[.U14]*[.AO$17]+[.V14]*[.AO$18]+[.X14]*[.AO$20])+[.Q14]*[.AO$14]+[.Y14]*[.AO$21]+[.AD14]*[.AO$27]) -> 3.3 | AF14: of:=[.AE14]+[.I14]-IF([.W14]>0;0;[.F14]+[.G14]+[.H14]) -> 1.3 | AG14: of:=[.AF14] -> 1.3 | AJ14: of:=IF([.F14]<5; 3; IF([.F14]<7; 2; 1)) -> 3 | AK14: 1 | AL14: 1 | AM14: 13 | AN14: Health | AO14: 0.4
A15: Varta Cruiser | B15: NA | C15: Building | F15: 5 | I15: of:=CEILING([.F15]/2;1) -> 3 | AE15: of:=IF([.W15]>0;[.AO$7]*[.W15];0)+IF([.W15]>0;[.AO$19];1)*IF([.R15]>0;[.R15];1)*IF([.AB15]=1;[.AB15]*[.AO$26];1)*(IF([.Z15]>0;[.AO$22];1)*([.J15]*[.AO$7]+[.K15]*[.AO$8]+[.L15]*[.AO$9]+[.N15]*[.AO$10]+[.O15]*[.AO$12]+[.P15]*[.AO$13]+[.S15]*[.AO$15]+[.T15]*[.AO$16]+[.U15]*[.AO$17]+[.V15]*[.AO$18]+[.X15]*[.AO$20])+[.Q15]*[.AO$14]+[.Y15]*[.AO$21]+[.AD15]*[.AO$27]) -> 0 | AF15: of:=[.AE15]+[.I15]-IF([.W15]>0;0;[.F15]+[.G15]+[.H15]) -> -2 | AG15: of:=[.AF15] -> -2 | AJ15: of:=IF([.F15]<5; 3; IF([.F15]<7; 2; 1)) -> 2 | AK15: 1 | AM15: 14 | AN15: Scrap Discard? | AO15: 1
A16: Kshatriya Destroyer | B16: NA | C16: Building | E16: Once per turn: gain 1 Strength for each Anima you have. You do not pay Anima for this effect | F16: 6 | I16: of:=CEILING([.F16]/2;1) -> 3 | AE16: of:=IF([.W16]>0;[.AO$7]*[.W16];0)+IF([.W16]>0;[.AO$19];1)*IF([.R16]>0;[.R16];1)*IF([.AB16]=1;[.AB16]*[.AO$26];1)*(IF([.Z16]>0;[.AO$22];1)*([.J16]*[.AO$7]+[.K16]*[.AO$8]+[.L16]*[.AO$9]+[.N16]*[.AO$10]+[.O16]*[.AO$12]+[.P16]*[.AO$13]+[.S16]*[.AO$15]+[.T16]*[.AO$16]+[.U16]*[.AO$17]+[.V16]*[.AO$18]+[.X16]*[.AO$20])+[.Q16]*[.AO$14]+[.Y16]*[.AO$21]+[.AD16]*[.AO$27]) -> 0 | AF16: of:=[.AE16]+[.I16]-IF([.W16]>0;0;[.F16]+[.G16]+[.H16]) -> -3 | AG16: of:=[.AF16] -> -3 | AJ16: of:=IF([.F16]<5; 3; IF([.F16]<7; 2; 1)) -> 2 | AK16: 1 | AM16: 15 | AN16: Scrap X? | AO16: 1.15
A17: Warrior of Shiva | B17: NA | C17: Human | E17: Pay X Anima. Reduce the Strength cost of all Creatures, Gods, and Mercenaries by X this turn | F17: 7 | I17: of:=CEILING([.F17]/2;1) -> 4 | AE17: of:=IF([.W17]>0;[.AO$7]*[.W17];0)+IF([.W17]>0;[.AO$19];1)*IF([.R17]>0;[.R17];1)*IF([.AB17]=1;[.AB17]*[.AO$26];1)*(IF([.Z17]>0;[.AO$22];1)*([.J17]*[.AO$7]+[.K17]*[.AO$8]+[.L17]*[.AO$9]+[.N17]*[.AO$10]+[.O17]*[.AO$12]+[.P17]*[.AO$13]+[.S17]*[.AO$15]+[.T17]*[.AO$16]+[.U17]*[.AO$17]+[.V17]*[.AO$18]+[.X17]*[.AO$20])+[.Q17]*[.AO$14]+[.Y17]*[.AO$21]+[.AD17]*[.AO$27]) -> 0 | AF17: of:=[.AE17]+[.I17]-IF([.W17]>0;0;[.F17]+[.G17]+[.H17]) -> -3 | AG17: of:=[.AF17] -> -3 | AJ17: of:=IF([.F17]<5; 3; IF([.F17]<7; 2; 1)) -> 1 | AK17: 1 | AL17: 1 | AM17: 16 | AN17: Draw X? | AO17: 0.8
A18: Heavy Bombardment | B18: NA | C18: Building | E18: Pay X Anima. Gain 2 Strength for each Anima paid | F18: 8 | I18: of:=CEILING([.F18]/2;1) -> 4 | J18: 1 | L18: 2 | R18: 3 | AE18: of:=IF([.W18]>0;[.AO$7]*[.W18];0)+IF([.W18]>0;[.AO$19];1)*IF([.R18]>0;[.R18];1)*IF([.AB18]=1;[.AB18]*[.AO$26];1)*(IF([.Z18]>0;[.AO$22];1)*([.J18]*[.AO$7]+[.K18]*[.AO$8]+[.L18]*[.AO$9]+[.N18]*[.AO$10]+[.O18]*[.AO$12]+[.P18]*[.AO$13]+[.S18]*[.AO$15]+[.T18]*[.AO$16]+[.U18]*[.AO$17]+[.V18]*[.AO$18]+[.X18]*[.AO$20])+[.Q18]*[.AO$14]+[.Y18]*[.AO$21]+[.AD18]*[.AO$27]) -> 4.5 | AF18: of:=[.AE18]+[.I18]-IF([.W18]>0;0;[.F18]+[.G18]+[.H18]) -> 0.5 | AG18: of:=[.AF18] -> 0.5 | AJ18: of:=IF([.F18]<5; 3; IF([.F18]<7; 2; 1)) -> 1 | AK18: 1 | AM18: 17 | AN18: Discard Y? | AO18: -0.6
A19: Quasar Death Laser | B19: NA | C19: Human | E19: Remove a God from play. Immediately gain Favor equal to its Favor | F19: 9 | I19: of:=CEILING([.F19]/2;1) -> 5 | AD19: of:=[.I95] -> 12.375 | AE19: of:=IF([.W19]>0;[.AO$7]*[.W19];0)+IF([.W19]>0;[.AO$19];1)*IF([.R19]>0;[.R19];1)*IF([.AB19]=1;[.AB19]*[.AO$26];1)*(IF([.Z19]>0;[.AO$22];1)*([.J19]*[.AO$7]+[.K19]*[.AO$8]+[.L19]*[.AO$9]+[.N19]*[.AO$10]+[.O19]*[.AO$12]+[.P19]*[.AO$13]+[.S19]*[.AO$15]+[.T19]*[.AO$16]+[.U19]*[.AO$17]+[.V19]*[.AO$18]+[.X19]*[.AO$20])+[.Q19]*[.AO$14]+[.Y19]*[.AO$21]+[.AD19]*[.AO$27]) -> 12.375 | AF19: of:=[.AE19]+[.I19]-IF([.W19]>0;0;[.F19]+[.G19]+[.H19]) -> 8.375 | AG19: of:=[.AF19] -> 8.375 | AJ19: of:=IF([.F19]<5; 3; IF([.F19]<7; 2; 1)) -> 1 | AK19: 1 | AL19: 1 | AM19: 18 | AN19: Upgrade Probability | AO19: 0.5 | AP19: basically a debuff since you won't always be able to upgrade the card before its first play
A20: Amerindian Total | J20: of:=SUM([.J8:.J19]) -> 5 | K20: of:=SUM([.K8:.K19]) -> 1 | L20: of:=SUM([.L8:.L19]) -> 11 | N20: of:=SUM([.N8:.N19]) -> 1 | O20: of:=SUM([.O8:.O19]) -> 0 | P20: of:=SUM([.P8:.P19]) -> 0 | Q20: of:=SUM([.Q8:.Q19]) -> 5 | R20: of:=SUM([.R8:.R19]) -> 3 | S20: of:=SUM([.S8:.S19]) -> 0 | T20: of:=SUM([.T8:.T19]) -> 0 | U20: of:=SUM([.U8:.U19]) -> 1 | V20: of:=SUM([.V8:.V19]) -> 0 | W20: of:=SUM([.W8:.W19]) -> 1 | X20: of:=SUM([.X8:.X19]) -> 1 | Y20: of:=SUM([.Y8:.Y19]) -> 0 | Z20: of:=SUM([.Z8:.Z19]) -> 0 | AA20: of:=SUM([.AA8:.AA19]) -> 1 | AB20: of:=SUM([.AB8:.AB19]) -> 1 | AD20: of:=SUM([.AD8:.AD19]) -> 12.375 | AE20: of:=IF([.W20]>0;[.AO$7]*[.W20];0)+IF([.W20]>0;[.AO$19];1)*IF([.R20]>0;[.R20];1)*IF([.AB20]=1;[.AB20]*[.AO$26];1)*(IF([.Z20]>0;[.AO$22];1)*([.J20]*[.AO$7]+[.K20]*[.AO$8]+[.L20]*[.AO$9]+[.N20]*[.AO$10]+[.O20]*[.AO$12]+[.P20]*[.AO$13]+[.S20]*[.AO$15]+[.T20]*[.AO$16]+[.U20]*[.AO$17]+[.V20]*[.AO$18]+[.X20]*[.AO$20])+[.Q20]*[.AO$14]+[.Y20]*[.AO$21]+[.AD20]*[.AO$27]) -> 15.025 | AF20: of:=[.AE20]+[.I20]-IF([.W20]>0;0;[.F20]+[.G20]+[.H20]) -> 15.025 | AG20: of:=[.AF20] -> 15.025 | AJ20: of:=SUM([.AJ8:.AJ19]) -> 22 | AM20: 19 | AN20: Pierce? | AO20: 0.2
A21: Sparky | B21: SU | C21: Human | E21: Draw 1 | F21: 1 | I21: of:=CEILING([.F21]/2;1) -> 1 | U21: 1 | AE21: of:=IF([.W21]>0;[.AO$7]*[.W21];0)+IF([.W21]>0;[.AO$19];1)*IF([.R21]>0;[.R21];1)*IF([.AB21]=1;[.AB21]*[.AO$26];1)*(IF([.Z21]>0;[.AO$22];1)*([.J21]*[.AO$7]+[.K21]*[.AO$8]+[.L21]*[.AO$9]+[.N21]*[.AO$10]+[.O21]*[.AO$12]+[.P21]*[.AO$13]+[.S21]*[.AO$15]+[.T21]*[.AO$16]+[.U21]*[.AO$17]+[.V21]*[.AO$18]+[.X21]*[.AO$20])+[.Q21]*[.AO$14]+[.Y21]*[.AO$21]+[.AD21]*[.AO$27]) -> 0.8 | AF21: of:=[.AE21]+[.I21]-IF([.W21]>0;0;[.F21]+[.G21]+[.H21]) -> 0.8 | AG21: of:=[.AF21]+[.AF22] -> 0.88 | AJ21: of:=IF([.F21]<5; 3; IF([.F21]<7; 2; 1)) -> 3 | AK21: 1 | AL21: 1 | AM21: 20 | AN21: Empower? | AO21: of:=[.AO16]-0.25 -> 0.9
A22: Ally | B22: SU | C22: Ability | E22: Draw 1 | U22: 1 | V22: 1 | AB22: 1 | AE22: of:=IF([.W22]>0;[.AO$7]*[.W22];0)+IF([.W22]>0;[.AO$19];1)*IF([.R22]>0;[.R22];1)*IF([.AB22]=1;[.AB22]*[.AO$26];1)*(IF([.Z22]>0;[.AO$22];1)*([.J22]*[.AO$7]+[.K22]*[.AO$8]+[.L22]*[.AO$9]+[.N22]*[.AO$10]+[.O22]*[.AO$12]+[.P22]*[.AO$13]+[.S22]*[.AO$15]+[.T22]*[.AO$16]+[.U22]*[.AO$17]+[.V22]*[.AO$18]+[.X22]*[.AO$20])+[.Q22]*[.AO$14]+[.Y22]*[.AO$21]+[.AD22]*[.AO$27]) -> 0.08 | AF22: of:=[.AE22]+[.I22]-IF([.W22]>0;0;[.F22]+[.G22]+[.H22]) -> 0.08 | AK22: 1 | AM22: 21 | AN22: X or Y? | AO22: 0.6
A23: Recon Bot | B23: SU | C23: Human | E23: Gain 1 Anima and draw a card | F23: 2 | I23: of:=CEILING([.F23]/2;1) -> 1 | N23: 1 | U23: 1 | AE23: of:=IF([.W23]>0;[.AO$7]*[.W23];0)+IF([.W23]>0;[.AO$19];1)*IF([.R23]>0;[.R23];1)*IF([.AB23]=1;[.AB23]*[.AO$26];1)*(IF([.Z23]>0;[.AO$22];1)*([.J23]*[.AO$7]+[.K23]*[.AO$8]+[.L23]*[.AO$9]+[.N23]*[.AO$10]+[.O23]*[.AO$12]+[.P23]*[.AO$13]+[.S23]*[.AO$15]+[.T23]*[.AO$16]+[.U23]*[.AO$17]+[.V23]*[.AO$18]+[.X23]*[.AO$20])+[.Q23]*[.AO$14]+[.Y23]*[.AO$21]+[.AD23]*[.AO$27]) -> 1.8 | AF23: of:=[.AE23]+[.I23]-IF([.W23]>0;0;[.F23]+[.G23]+[.H23]) -> 0.8 | AG23: of:=[.AF23] -> 0.8 | AJ23: of:=IF([.F23]<5; 3; IF([.F23]<7; 2; 1)) -> 3 | AK23: 1 | AL23: 1 | AM23: 22 | AN23: Trash? | AO23: 0.33
A24: Ally | B24: SU | C24: Ability | E24: Gain 1 Anima | N24: 1 | AB24: 1 | AE24: of:=IF([.W24]>0;[.AO$7]*[.W24];0)+IF([.W24]>0;[.AO$19];1)*IF([.R24]>0;[.R24];1)*IF([.AB24]=1;[.AB24]*[.AO$26];1)*(IF([.Z24]>0;[.AO$22];1)*([.J24]*[.AO$7]+[.K24]*[.AO$8]+[.L24]*[.AO$9]+[.N24]*[.AO$10]+[.O24]*[.AO$12]+[.P24]*[.AO$13]+[.S24]*[.AO$15]+[.T24]*[.AO$16]+[.U24]*[.AO$17]+[.V24]*[.AO$18]+[.X24]*[.AO$20])+[.Q24]*[.AO$14]+[.Y24]*[.AO$21]+[.AD24]*[.AO$27]) -> 0.4 | AF24: of:=[.AE24]+[.I24]-IF([.W24]>0;0;[.F24]+[.G24]+[.H24]) -> 0.4 | AK24: 1 | AM24: 23 | AN24: Fortification? | AO24: 2
A25: 343rd Battalion | B25: SU | C25: Building | F25: 3 | I25: of:=CEILING([.F25]/2;1) -> 2 | L25: 1 | AE25: of:=IF([.W25]>0;[.AO$7]*[.W25];0)+IF([.W25]>0;[.AO$19];1)*IF([.R25]>0;[.R25];1)*IF([.AB25]=1;[.AB25]*[.AO$26];1)*(IF([.Z25]>0;[.AO$22];1)*([.J25]*[.AO$7]+[.K25]*[.AO$8]+[.L25]*[.AO$9]+[.N25]*[.AO$10]+[.O25]*[.AO$12]+[.P25]*[.AO$13]+[.S25]*[.AO$15]+[.T25]*[.AO$16]+[.U25]*[.AO$17]+[.V25]*[.AO$18]+[.X25]*[.AO$20])+[.Q25]*[.AO$14]+[.Y25]*[.AO$21]+[.AD25]*[.AO$27]) -> 1 | AF25: of:=[.AE25]+[.I25]-IF([.W25]>0;0;[.F25]+[.G25]+[.H25]) -> 0 | AG25: of:=[.AF25] -> 0 | AJ25: of:=IF([.F25]<5; 3; IF([.F25]<7; 2; 1)) -> 3 | AK25: 1 | AM25: 24 | AN25: Building? | AO25: 3
A26: Sol Cruiser | B26: SU | C26: Human | F26: 4 | I26: of:=CEILING([.F26]/2;1) -> 2 | AE26: of:=IF([.W26]>0;[.AO$7]*[.W26];0)+IF([.W26]>0;[.AO$19];1)*IF([.R26]>0;[.R26];1)*IF([.AB26]=1;[.AB26]*[.AO$26];1)*(IF([.Z26]>0;[.AO$22];1)*([.J26]*[.AO$7]+[.K26]*[.AO$8]+[.L26]*[.AO$9]+[.N26]*[.AO$10]+[.O26]*[.AO$12]+[.P26]*[.AO$13]+[.S26]*[.AO$15]+[.T26]*[.AO$16]+[.U26]*[.AO$17]+[.V26]*[.AO$18]+[.X26]*[.AO$20])+[.Q26]*[.AO$14]+[.Y26]*[.AO$21]+[.AD26]*[.AO$27]) -> 0 | AF26: of:=[.AE26]+[.I26]-IF([.W26]>0;0;[.F26]+[.G26]+[.H26]) -> -2 | AG26: of:=[.AF26] -> -2 | AJ26: of:=IF([.F26]<5; 3; IF([.F26]<7; 2; 1)) -> 3 | AK26: 1 | AL26: 1 | AM26: 25 | AN26: Ally? | AO26: 0.4
B27: SU | AE27: of:=IF([.W27]>0;[.AO$7]*[.W27];0)+IF([.W27]>0;[.AO$19];1)*IF([.R27]>0;[.R27];1)*IF([.AB27]=1;[.AB27]*[.AO$26];1)*(IF([.Z27]>0;[.AO$22];1)*([.J27]*[.AO$7]+[.K27]*[.AO$8]+[.L27]*[.AO$9]+[.N27]*[.AO$10]+[.O27]*[.AO$12]+[.P27]*[.AO$13]+[.S27]*[.AO$15]+[.T27]*[.AO$16]+[.U27]*[.AO$17]+[.V27]*[.AO$18]+[.X27]*[.AO$20])+[.Q27]*[.AO$14]+[.Y27]*[.AO$21]+[.AD27]*[.AO$27]) -> 0 | AF27: of:=[.AE27]+[.I27]-IF([.W27]>0;0;[.F27]+[.G27]+[.H27]) -> 0 | AK27: 1 | AM27: 26 | AN27: Additional Effects Weight | AO27: 1
A28: Hades Battlebot | B28: SU | C28: Human | E28: Pay 2 Anima to gain 4 Strength | F28: 5 | I28: of:=CEILING([.F28]/2;1) -> 3 | J28: 2 | L28: 4 | AE28: of:=IF([.W28]>0;[.AO$7]*[.W28];0)+IF([.W28]>0;[.AO$19];1)*IF([.R28]>0;[.R28];1)*IF([.AB28]=1;[.AB28]*[.AO$26];1)*(IF([.Z28]>0;[.AO$22];1)*([.J28]*[.AO$7]+[.K28]*[.AO$8]+[.L28]*[.AO$9]+[.N28]*[.AO$10]+[.O28]*[.AO$12]+[.P28]*[.AO$13]+[.S28]*[.AO$15]+[.T28]*[.AO$16]+[.U28]*[.AO$17]+[.V28]*[.AO$18]+[.X28]*[.AO$20])+[.Q28]*[.AO$14]+[.Y28]*[.AO$21]+[.AD28]*[.AO$27]) -> 3 | AF28: of:=[.AE28]+[.I28]-IF([.W28]>0;0;[.F28]+[.G28]+[.H28]) -> 1 | AG28: of:=[.AF28]+[.AF29] -> 1.64 | AJ28: of:=IF([.F28]<5; 3; IF([.F28]<7; 2; 1)) -> 2 | AK28: 1 | AL28: 1 | AM28: 27
A29: Ally | B29: SU | C29: Ally | E29: Draw 2 Cards | U29: 2 | AB29: 1 | AE29: of:=IF([.W29]>0;[.AO$7]*[.W29];0)+IF([.W29]>0;[.AO$19];1)*IF([.R29]>0;[.R29];1)*IF([.AB29]=1;[.AB29]*[.AO$26];1)*(IF([.Z29]>0;[.AO$22];1)*([.J29]*[.AO$7]+[.K29]*[.AO$8]+[.L29]*[.AO$9]+[.N29]*[.AO$10]+[.O29]*[.AO$12]+[.P29]*[.AO$13]+[.S29]*[.AO$15]+[.T29]*[.AO$16]+[.U29]*[.AO$17]+[.V29]*[.AO$18]+[.X29]*[.AO$20])+[.Q29]*[.AO$14]+[.Y29]*[.AO$21]+[.AD29]*[.AO$27]) -> 0.64 | AF29: of:=[.AE29]+[.I29]-IF([.W29]>0;0;[.F29]+[.G29]+[.H29]) -> 0.64 | AK29: 1 | AM29: 28
A30: Titanic Mega-Crusher | B30: SU | C30: Human | E30: Pay 3 Anima to gain 5 Strength. Upgrade: You may pay 3 Anima to upgrade this into Olympic Crusher | F30: 6 | I30: of:=CEILING([.F30]/2;1) -> 3 | J30: 3 | L30: 5 | AE30: of:=IF([.W30]>0;[.AO$7]*[.W30];0)+IF([.W30]>0;[.AO$19];1)*IF([.R30]>0;[.R30];1)*IF([.AB30]=1;[.AB30]*[.AO$26];1)*(IF([.Z30]>0;[.AO$22];1)*([.J30]*[.AO$7]+[.K30]*[.AO$8]+[.L30]*[.AO$9]+[.N30]*[.AO$10]+[.O30]*[.AO$12]+[.P30]*[.AO$13]+[.S30]*[.AO$15]+[.T30]*[.AO$16]+[.U30]*[.AO$17]+[.V30]*[.AO$18]+[.X30]*[.AO$20])+[.Q30]*[.AO$14]+[.Y30]*[.AO$21]+[.AD30]*[.AO$27]) -> 3.5 | AF30: of:=[.AE30]+[.I30]-IF([.W30]>0;0;[.F30]+[.G30]+[.H30]) -> 0.5 | AG30: of:=[.AF30]+[.AF31]+[.AF32]+[.AF33] -> 2.64 | AJ30: of:=IF([.F30]<5; 3; IF([.F30]<7; 2; 1)) -> 2 | AK30: 1 | AL30: 1 | AM30: 29
A31: Ally | B31: SU | C31: Ability | E31: Draw 1 | U31: 1 | AB31: 1 | AE31: of:=IF([.W31]>0;[.AO$7]*[.W31];0)+IF([.W31]>0;[.AO$19];1)*IF([.R31]>0;[.R31];1)*IF([.AB31]=1;[.AB31]*[.AO$26];1)*(IF([.Z31]>0;[.AO$22];1)*([.J31]*[.AO$7]+[.K31]*[.AO$8]+[.L31]*[.AO$9]+[.N31]*[.AO$10]+[.O31]*[.AO$12]+[.P31]*[.AO$13]+[.S31]*[.AO$15]+[.T31]*[.AO$16]+[.U31]*[.AO$17]+[.V31]*[.AO$18]+[.X31]*[.AO$20])+[.Q31]*[.AO$14]+[.Y31]*[.AO$21]+[.AD31]*[.AO$27]) -> 0.32 | AF31: of:=[.AE31]+[.I31]-IF([.W31]>0;0;[.F31]+[.G31]+[.H31]) -> 0.32 | AK31: 1 | AM31: 30
A32: Upgrade: Olympic Giga-Crusher | B32: SU | C32: Human | E32: Pay 2 Anima to gain 5 Strength | I32: 1 | J32: 2 | L32: 5 | W32: 3 | AE32: of:=IF([.W32]>0;[.AO$7]*[.W32];0)+IF([.W32]>0;[.AO$19];1)*IF([.R32]>0;[.R32];1)*IF([.AB32]=1;[.AB32]*[.AO$26];1)*(IF([.Z32]>0;[.AO$22];1)*([.J32]*[.AO$7]+[.K32]*[.AO$8]+[.L32]*[.AO$9]+[.N32]*[.AO$10]+[.O32]*[.AO$12]+[.P32]*[.AO$13]+[.S32]*[.AO$15]+[.T32]*[.AO$16]+[.U32]*[.AO$17]+[.V32]*[.AO$18]+[.X32]*[.AO$20])+[.Q32]*[.AO$14]+[.Y32]*[.AO$21]+[.AD32]*[.AO$27]) -> 0.5 | AF32: of:=[.AE32]+[.I32]-IF([.W32]>0;0;[.F32]+[.G32]+[.H32]) -> 1.5 | AG32: of:=[.AF32]+[.AF33] -> 1.82 | AJ32: of:=IF([.F32]<5; 3; IF([.F32]<7; 2; 1)) -> 3 | AK32: 1 | AM32: 31
A33: Ally | B33: SU | C33: Ability | E33: Draw 1 | U33: 1 | AB33: 1 | AE33: of:=IF([.W33]>0;[.AO$7]*[.W33];0)+IF([.W33]>0;[.AO$19];1)*IF([.R33]>0;[.R33];1)*IF([.AB33]=1;[.AB33]*[.AO$26];1)*(IF([.Z33]>0;[.AO$22];1)*([.J33]*[.AO$7]+[.K33]*[.AO$8]+[.L33]*[.AO$9]+[.N33]*[.AO$10]+[.O33]*[.AO$12]+[.P33]*[.AO$13]+[.S33]*[.AO$15]+[.T33]*[.AO$16]+[.U33]*[.AO$17]+[.V33]*[.AO$18]+[.X33]*[.AO$20])+[.Q33]*[.AO$14]+[.Y33]*[.AO$21]+[.AD33]*[.AO$27]) -> 0.32 | AF33: of:=[.AE33]+[.I33]-IF([.W33]>0;0;[.F33]+[.G33]+[.H33]) -> 0.32 | AK33: 1 | AM33: 32
B34: SU | C34: Human | F34: 7 | I34: of:=CEILING([.F34]/2;1) -> 4 | AE34: of:=IF([.W34]>0;[.AO$7]*[.W34];0)+IF([.W34]>0;[.AO$19];1)*IF([.R34]>0;[.R34];1)*IF([.AB34]=1;[.AB34]*[.AO$26];1)*(IF([.Z34]>0;[.AO$22];1)*([.J34]*[.AO$7]+[.K34]*[.AO$8]+[.L34]*[.AO$9]+[.N34]*[.AO$10]+[.O34]*[.AO$12]+[.P34]*[.AO$13]+[.S34]*[.AO$15]+[.T34]*[.AO$16]+[.U34]*[.AO$17]+[.V34]*[.AO$18]+[.X34]*[.AO$20])+[.Q34]*[.AO$14]+[.Y34]*[.AO$21]+[.AD34]*[.AO$27]) -> 0 | AF34: of:=[.AE34]+[.I34]-IF([.W34]>0;0;[.F34]+[.G34]+[.H34]) -> -3 | AG34: of:=[.AF34] -> -3 | AJ34: of:=IF([.F34]<5; 3; IF([.F34]<7; 2; 1)) -> 1 | AK34: 1 | AM34: 33
A35: Heracles Killbot | B35: SU | C35: Human | E35: Gain 5 Anima | F35: 8 | I35: of:=CEILING([.F35]/2;1) -> 4 | N35: 5 | AE35: of:=IF([.W35]>0;[.AO$7]*[.W35];0)+IF([.W35]>0;[.AO$19];1)*IF([.R35]>0;[.R35];1)*IF([.AB35]=1;[.AB35]*[.AO$26];1)*(IF([.Z35]>0;[.AO$22];1)*([.J35]*[.AO$7]+[.K35]*[.AO$8]+[.L35]*[.AO$9]+[.N35]*[.AO$10]+[.O35]*[.AO$12]+[.P35]*[.AO$13]+[.S35]*[.AO$15]+[.T35]*[.AO$16]+[.U35]*[.AO$17]+[.V35]*[.AO$18]+[.X35]*[.AO$20])+[.Q35]*[.AO$14]+[.Y35]*[.AO$21]+[.AD35]*[.AO$27]) -> 5 | AF35: of:=[.AE35]+[.I35]-IF([.W35]>0;0;[.F35]+[.G35]+[.H35]) -> 1 | AG35: of:=[.AF35]+[.AF36] -> 1.96 | AH35: Enjoys stabbing | AJ35: of:=IF([.F35]<5; 3; IF([.F35]<7; 2; 1)) -> 1 | AK35: 1 | AL35: 1 | AM35: 34
A36: Ally | B36: SU | C36: Ability | E36: Pay X Anima. Draw 1 card for each Anima paid | J36: 1 | R36: 8 | U36: 1 | AB36: 1 | AE36: of:=IF([.W36]>0;[.AO$7]*[.W36];0)+IF([.W36]>0;[.AO$19];1)*IF([.R36]>0;[.R36];1)*IF([.AB36]=1;[.AB36]*[.AO$26];1)*(IF([.Z36]>0;[.AO$22];1)*([.J36]*[.AO$7]+[.K36]*[.AO$8]+[.L36]*[.AO$9]+[.N36]*[.AO$10]+[.O36]*[.AO$12]+[.P36]*[.AO$13]+[.S36]*[.AO$15]+[.T36]*[.AO$16]+[.U36]*[.AO$17]+[.V36]*[.AO$18]+[.X36]*[.AO$20])+[.Q36]*[.AO$14]+[.Y36]*[.AO$21]+[.AD36]*[.AO$27]) -> 0.96 | AF36: of:=[.AE36]+[.I36]-IF([.W36]>0;0;[.F36]+[.G36]+[.H36]) -> 0.96 | AK36: 1 | AM36: 35
A37: Primordia the God-Creator | B37: SU | C37: Human | E37: Reveal the top card of the God deck. Assimilate it for free | F37: 9 | I37: of:=CEILING([.F37]/2;1) -> 5 | AD37: of:=[.I95] -> 12.375 | AE37: of:=IF([.W37]>0;[.AO$7]*[.W37];0)+IF([.W37]>0;[.AO$19];1)*IF([.R37]>0;[.R37];1)*IF([.AB37]=1;[.AB37]*[.AO$26];1)*(IF([.Z37]>0;[.AO$22];1)*([.J37]*[.AO$7]+[.K37]*[.AO$8]+[.L37]*[.AO$9]+[.N37]*[.AO$10]+[.O37]*[.AO$12]+[.P37]*[.AO$13]+[.S37]*[.AO$15]+[.T37]*[.AO$16]+[.U37]*[.AO$17]+[.V37]*[.AO$18]+[.X37]*[.AO$20])+[.Q37]*[.AO$14]+[.Y37]*[.AO$21]+[.AD37]*[.AO$27]) -> 12.375 | AF37: of:=[.AE37]+[.I37]-IF([.W37]>0;0;[.F37]+[.G37]+[.H37]) -> 8.375 | AG37: of:=[.AF37] -> 8.375 | AJ37: of:=IF([.F37]<5; 3; IF([.F37]<7; 2; 1)) -> 1 | AK37: 1 | AL37: 1 | AM37: 36
A38: Sumerian Total | J38: of:=SUM([.J21:.J37]) -> 8 | K38: of:=SUM([.K21:.K37]) -> 0 | L38: of:=SUM([.L21:.L37]) -> 15 | N38: of:=SUM([.N21:.N37]) -> 7 | O38: of:=SUM([.O21:.O37]) -> 0 | P38: of:=SUM([.P21:.P37]) -> 0 | Q38: of:=SUM([.Q21:.Q37]) -> 0 | R38: of:=SUM([.R21:.R37]) -> 8 | S38: of:=SUM([.S21:.S37]) -> 0 | T38: of:=SUM([.T21:.T37]) -> 0 | U38: of:=SUM([.U21:.U37]) -> 8 | V38: of:=SUM([.V21:.V37]) -> 1 | W38: of:=SUM([.W21:.W37]) -> 3 | X38: of:=SUM([.X21:.X37]) -> 0 | Y38: of:=SUM([.Y21:.Y37]) -> 0 | Z38: of:=SUM([.Z21:.Z37]) -> 0 | AA38: of:=SUM([.AA21:.AA37]) -> 0 | AB38: of:=SUM([.AB21:.AB37]) -> 6 | AD38: of:=SUM([.AD21:.AD37]) -> 12.375 | AE38: of:=IF([.W38]>0;[.AO$7]*[.W38];0)+IF([.W38]>0;[.AO$19];1)*IF([.R38]>0;[.R38];1)*IF([.AB38]=1;[.AB38]*[.AO$26];1)*(IF([.Z38]>0;[.AO$22];1)*([.J38]*[.AO$7]+[.K38]*[.AO$8]+[.L38]*[.AO$9]+[.N38]*[.AO$10]+[.O38]*[.AO$12]+[.P38]*[.AO$13]+[.S38]*[.AO$15]+[.T38]*[.AO$16]+[.U38]*[.AO$17]+[.V38]*[.AO$18]+[.X38]*[.AO$20])+[.Q38]*[.AO$14]+[.Y38]*[.AO$21]+[.AD38]*[.AO$27]) -> 143.2 | AF38: of:=[.AE38]+[.I38]-IF([.W38]>0;0;[.F38]+[.G38]+[.H38]) -> 143.2 | AJ38: of:=SUM([.AJ21:.AJ37]) -> 22 | AM38: 37
AE39: of:=IF([.W39]>0;[.AO$7]*[.W39];0)+IF([.W39]>0;[.AO$19];1)*IF([.R39]>0;[.R39];1)*IF([.AB39]=1;[.AB39]*[.AO$26];1)*(IF([.Z39]>0;[.AO$22];1)*([.J39]*[.AO$7]+[.K39]*[.AO$8]+[.L39]*[.AO$9]+[.N39]*[.AO$10]+[.O39]*[.AO$12]+[.P39]*[.AO$13]+[.S39]*[.AO$15]+[.T39]*[.AO$16]+[.U39]*[.AO$17]+[.V39]*[.AO$18]+[.X39]*[.AO$20])+[.Q39]*[.AO$14]+[.Y39]*[.AO$21]+[.AD39]*[.AO$27]) -> 0 | AF39: of:=[.AE39]+[.I39]-IF([.W39]>0;0;[.F39]+[.G39]+[.H39]) -> 0 | AK39: 1 | AM39: 38
A40: Asteroid Miner | B40: EG | C40: Human | E40: Pay 1 Anima to gain 2 Trade | F40: 1 | I40: of:=CEILING([.F40]/2;1) -> 1 | J40: 1 | K40: 2 | AE40: of:=IF([.W40]>0;[.AO$7]*[.W40];0)+IF([.W40]>0;[.AO$19];1)*IF([.R40]>0;[.R40];1)*IF([.AB40]=1;[.AB40]*[.AO$26];1)*(IF([.Z40]>0;[.AO$22];1)*([.J40]*[.AO$7]+[.K40]*[.AO$8]+[.L40]*[.AO$9]+[.N40]*[.AO$10]+[.O40]*[.AO$12]+[.P40]*[.AO$13]+[.S40]*[.AO$15]+[.T40]*[.AO$16]+[.U40]*[.AO$17]+[.V40]*[.AO$18]+[.X40]*[.AO$20])+[.Q40]*[.AO$14]+[.Y40]*[.AO$21]+[.AD40]*[.AO$27]) -> 1.5 | AF40: of:=[.AE40]+[.I40]-IF([.W40]>0;0;[.F40]+[.G40]+[.H40]) -> 1.5 | AG40: of:=[.AF40] -> 1.5 | AJ40: of:=IF([.F40]<5; 3; IF([.F40]<7; 2; 1)) -> 3 | AK40: 1 | AL40: 1 | AM40: 39
A41: Aeraria Fortification | B41: EG | C41: Fortification | F41: 2 | I41: of:=CEILING([.F41]/2;1) -> 1 | Q41: 2 | U41: 1 | AE41: of:=IF([.W41]>0;[.AO$7]*[.W41];0)+IF([.W41]>0;[.AO$19];1)*IF([.R41]>0;[.R41];1)*IF([.AB41]=1;[.AB41]*[.AO$26];1)*(IF([.Z41]>0;[.AO$22];1)*([.J41]*[.AO$7]+[.K41]*[.AO$8]+[.L41]*[.AO$9]+[.N41]*[.AO$10]+[.O41]*[.AO$12]+[.P41]*[.AO$13]+[.S41]*[.AO$15]+[.T41]*[.AO$16]+[.U41]*[.AO$17]+[.V41]*[.AO$18]+[.X41]*[.AO$20])+[.Q41]*[.AO$14]+[.Y41]*[.AO$21]+[.AD41]*[.AO$27]) -> 1.6 | AF41: of:=[.AE41]+[.I41]-IF([.W41]>0;0;[.F41]+[.G41]+[.H41]) -> 0.6 | AG41: of:=[.AF41] -> 0.6 | AJ41: of:=IF([.F41]<5; 3; IF([.F41]<7; 2; 1)) -> 3 | AK41: 1 | AM41: 40
A42: New Horizon | B42: EG | C42: Human | E42: Gain 2 Anima | F42: 3 | I42: of:=CEILING([.F42]/2;1) -> 2 | N42: 2 | AE42: of:=IF([.W42]>0;[.AO$7]*[.W42];0)+IF([.W42]>0;[.AO$19];1)*IF([.R42]>0;[.R42];1)*IF([.AB42]=1;[.AB42]*[.AO$26];1)*(IF([.Z42]>0;[.AO$22];1)*([.J42]*[.AO$7]+[.K42]*[.AO$8]+[.L42]*[.AO$9]+[.N42]*[.AO$10]+[.O42]*[.AO$12]+[.P42]*[.AO$13]+[.S42]*[.AO$15]+[.T42]*[.AO$16]+[.U42]*[.AO$17]+[.V42]*[.AO$18]+[.X42]*[.AO$20])+[.Q42]*[.AO$14]+[.Y42]*[.AO$21]+[.AD42]*[.AO$27]) -> 2 | AF42: of:=[.AE42]+[.I42]-IF([.W42]>0;0;[.F42]+[.G42]+[.H42]) -> 1 | AG42: of:=[.AF42]+[.AF43] -> 1.8 | AJ42: of:=IF([.F42]<5; 3; IF([.F42]<7; 2; 1)) -> 3 | AK42: 1 | AL42: 1 | AM42: 41
A43: Ally | B43: EG | C43: Ability | E43: Gain 2 Trade | K43: 2 | AB43: 1 | AE43: of:=IF([.W43]>0;[.AO$7]*[.W43];0)+IF([.W43]>0;[.AO$19];1)*IF([.R43]>0;[.R43];1)*IF([.AB43]=1;[.AB43]*[.AO$26];1)*(IF([.Z43]>0;[.AO$22];1)*([.J43]*[.AO$7]+[.K43]*[.AO$8]+[.L43]*[.AO$9]+[.N43]*[.AO$10]+[.O43]*[.AO$12]+[.P43]*[.AO$13]+[.S43]*[.AO$15]+[.T43]*[.AO$16]+[.U43]*[.AO$17]+[.V43]*[.AO$18]+[.X43]*[.AO$20])+[.Q43]*[.AO$14]+[.Y43]*[.AO$21]+[.AD43]*[.AO$27]) -> 0.8 | AF43: of:=[.AE43]+[.I43]-IF([.W43]>0;0;[.F43]+[.G43]+[.H43]) -> 0.8 | AK43: 1 | AM43: 42
A44: Proton Reflector | B44: EG | C44: Fortification | F44: 4 | I44: of:=CEILING([.F44]/2;1) -> 2 | L44: 1 | Q44: 3 | U44: 1 | AE44: of:=IF([.W44]>0;[.AO$7]*[.W44];0)+IF([.W44]>0;[.AO$19];1)*IF([.R44]>0;[.R44];1)*IF([.AB44]=1;[.AB44]*[.AO$26];1)*(IF([.Z44]>0;[.AO$22];1)*([.J44]*[.AO$7]+[.K44]*[.AO$8]+[.L44]*[.AO$9]+[.N44]*[.AO$10]+[.O44]*[.AO$12]+[.P44]*[.AO$13]+[.S44]*[.AO$15]+[.T44]*[.AO$16]+[.U44]*[.AO$17]+[.V44]*[.AO$18]+[.X44]*[.AO$20])+[.Q44]*[.AO$14]+[.Y44]*[.AO$21]+[.AD44]*[.AO$27]) -> 3 | AF44: of:=[.AE44]+[.I44]-IF([.W44]>0;0;[.F44]+[.G44]+[.H44]) -> 1 | AG44: of:=[.AF44] -> 1 | AJ44: of:=IF([.F44]<5; 3; IF([.F44]<7; 2; 1)) -> 3 | AK44: 1 | AM44: 43
A45: Fortification-mender | B45: EG | C45: Building | E45: Gain 1 Anima. You may place a Fortification from your discard on top of your deck | F45: 5 | I45: of:=CEILING([.F45]/2;1) -> 3 | N45: 1 | AD45: 1.5 | AE45: of:=IF([.W45]>0;[.AO$7]*[.W45];0)+IF([.W45]>0;[.AO$19];1)*IF([.R45]>0;[.R45];1)*IF([.AB45]=1;[.AB45]*[.AO$26];1)*(IF([.Z45]>0;[.AO$22];1)*([.J45]*[.AO$7]+[.K45]*[.AO$8]+[.L45]*[.AO$9]+[.N45]*[.AO$10]+[.O45]*[.AO$12]+[.P45]*[.AO$13]+[.S45]*[.AO$15]+[.T45]*[.AO$16]+[.U45]*[.AO$17]+[.V45]*[.AO$18]+[.X45]*[.AO$20])+[.Q45]*[.AO$14]+[.Y45]*[.AO$21]+[.AD45]*[.AO$27]) -> 2.5 | AF45: of:=[.AE45]+[.I45]-IF([.W45]>0;0;[.F45]+[.G45]+[.H45]) -> 0.5 | AG45: of:=[.AF45]+[.AF46] -> 0.82 | AJ45: of:=IF([.F45]<5; 3; IF([.F45]<7; 2; 1)) -> 2 | AK45: 1 | AL45: 1 | AM45: 44
A46: Ally | B46: EG | C46: Ability | E46: Draw 1 card | U46: 1 | AB46: 1 | AE46: of:=IF([.W46]>0;[.AO$7]*[.W46];0)+IF([.W46]>0;[.AO$19];1)*IF([.R46]>0;[.R46];1)*IF([.AB46]=1;[.AB46]*[.AO$26];1)*(IF([.Z46]>0;[.AO$22];1)*([.J46]*[.AO$7]+[.K46]*[.AO$8]+[.L46]*[.AO$9]+[.N46]*[.AO$10]+[.O46]*[.AO$12]+[.P46]*[.AO$13]+[.S46]*[.AO$15]+[.T46]*[.AO$16]+[.U46]*[.AO$17]+[.V46]*[.AO$18]+[.X46]*[.AO$20])+[.Q46]*[.AO$14]+[.Y46]*[.AO$21]+[.AD46]*[.AO$27]) -> 0.32 | AF46: of:=[.AE46]+[.I46]-IF([.W46]>0;0;[.F46]+[.G46]+[.H46]) -> 0.32 | AK46: 1 | AM46: 45
A47: Hyades Destroyer | B47: EG | C47: Building | E47: Pay 4 Anima to gain 5 Strength and 2 Anima | F47: 5 | I47: of:=CEILING([.F47]/2;1) -> 3 | J47: 4 | L47: 5 | N47: 2 | AE47: of:=IF([.W47]>0;[.AO$7]*[.W47];0)+IF([.W47]>0;[.AO$19];1)*IF([.R47]>0;[.R47];1)*IF([.AB47]=1;[.AB47]*[.AO$26];1)*(IF([.Z47]>0;[.AO$22];1)*([.J47]*[.AO$7]+[.K47]*[.AO$8]+[.L47]*[.AO$9]+[.N47]*[.AO$10]+[.O47]*[.AO$12]+[.P47]*[.AO$13]+[.S47]*[.AO$15]+[.T47]*[.AO$16]+[.U47]*[.AO$17]+[.V47]*[.AO$18]+[.X47]*[.AO$20])+[.Q47]*[.AO$14]+[.Y47]*[.AO$21]+[.AD47]*[.AO$27]) -> 5 | AF47: of:=[.AE47]+[.I47]-IF([.W47]>0;0;[.F47]+[.G47]+[.H47]) -> 3 | AG47: of:=[.AF47] -> 3 | AJ47: of:=IF([.F47]<5; 3; IF([.F47]<7; 2; 1)) -> 2 | AK47: 1 | AM47: 46
A48: Ida Fortification | B48: EG | C48: Fortification | F48: 6 | I48: of:=CEILING([.F48]/2;1) -> 3 | N48: 1 | Q48: 4 | U48: 1 | AE48: of:=IF([.W48]>0;[.AO$7]*[.W48];0)+IF([.W48]>0;[.AO$19];1)*IF([.R48]>0;[.R48];1)*IF([.AB48]=1;[.AB48]*[.AO$26];1)*(IF([.Z48]>0;[.AO$22];1)*([.J48]*[.AO$7]+[.K48]*[.AO$8]+[.L48]*[.AO$9]+[.N48]*[.AO$10]+[.O48]*[.AO$12]+[.P48]*[.AO$13]+[.S48]*[.AO$15]+[.T48]*[.AO$16]+[.U48]*[.AO$17]+[.V48]*[.AO$18]+[.X48]*[.AO$20])+[.Q48]*[.AO$14]+[.Y48]*[.AO$21]+[.AD48]*[.AO$27]) -> 3.4 | AF48: of:=[.AE48]+[.I48]-IF([.W48]>0;0;[.F48]+[.G48]+[.H48]) -> 0.4 | AG48: of:=[.AF48] -> 0.4 | AJ48: of:=IF([.F48]<5; 3; IF([.F48]<7; 2; 1)) -> 2 | AK48: 1 | AM48: 47
A49: Star Gatherer | B49: EG | C49: Human | E49: Pay 2 Anima to gain 5 Trade | F49: 6 | I49: of:=CEILING([.F49]/2;1) -> 3 | J49: 2 | K49: 5 | AE49: of:=IF([.W49]>0;[.AO$7]*[.W49];0)+IF([.W49]>0;[.AO$19];1)*IF([.R49]>0;[.R49];1)*IF([.AB49]=1;[.AB49]*[.AO$26];1)*(IF([.Z49]>0;[.AO$22];1)*([.J49]*[.AO$7]+[.K49]*[.AO$8]+[.L49]*[.AO$9]+[.N49]*[.AO$10]+[.O49]*[.AO$12]+[.P49]*[.AO$13]+[.S49]*[.AO$15]+[.T49]*[.AO$16]+[.U49]*[.AO$17]+[.V49]*[.AO$18]+[.X49]*[.AO$20])+[.Q49]*[.AO$14]+[.Y49]*[.AO$21]+[.AD49]*[.AO$27]) -> 4 | AF49: of:=[.AE49]+[.I49]-IF([.W49]>0;0;[.F49]+[.G49]+[.H49]) -> 1 | AG49: of:=[.AF49]+[.AF50] -> 2 | AJ49: of:=IF([.F49]<5; 3; IF([.F49]<7; 2; 1)) -> 2 | AK49: 1 | AL49: 1 | AM49: 48
A50: Ally | B50: EG | C50: Ability | E50: Pay 1 Anima to gain 3 Trade | J50: 1 | K50: 3 | AB50: 1 | AE50: of:=IF([.W50]>0;[.AO$7]*[.W50];0)+IF([.W50]>0;[.AO$19];1)*IF([.R50]>0;[.R50];1)*IF([.AB50]=1;[.AB50]*[.AO$26];1)*(IF([.Z50]>0;[.AO$22];1)*([.J50]*[.AO$7]+[.K50]*[.AO$8]+[.L50]*[.AO$9]+[.N50]*[.AO$10]+[.O50]*[.AO$12]+[.P50]*[.AO$13]+[.S50]*[.AO$15]+[.T50]*[.AO$16]+[.U50]*[.AO$17]+[.V50]*[.AO$18]+[.X50]*[.AO$20])+[.Q50]*[.AO$14]+[.Y50]*[.AO$21]+[.AD50]*[.AO$27]) -> 1 | AF50: of:=[.AE50]+[.I50]-IF([.W50]>0;0;[.F50]+[.G50]+[.H50]) -> 1 | AK50: 1 | AM50: 49
A51: Godmender | B51: EG | C51: Human | E51: Pay 3 Anima to Heal 3 on any God | F51: 7 | I51: of:=CEILING([.F51]/2;1) -> 4 | AE51: of:=IF([.W51]>0;[.AO$7]*[.W51];0)+IF([.W51]>0;[.AO$19];1)*IF([.R51]>0;[.R51];1)*IF([.AB51]=1;[.AB51]*[.AO$26];1)*(IF([.Z51]>0;[.AO$22];1)*([.J51]*[.AO$7]+[.K51]*[.AO$8]+[.L51]*[.AO$9]+[.N51]*[.AO$10]+[.O51]*[.AO$12]+[.P51]*[.AO$13]+[.S51]*[.AO$15]+[.T51]*[.AO$16]+[.U51]*[.AO$17]+[.V51]*[.AO$18]+[.X51]*[.AO$20])+[.Q51]*[.AO$14]+[.Y51]*[.AO$21]+[.AD51]*[.AO$27]) -> 0 | AF51: of:=[.AE51]+[.I51]-IF([.W51]>0;0;[.F51]+[.G51]+[.H51]) -> -3 | AG51: of:=[.AF51] -> -3 | AJ51: of:=IF([.F51]<5; 3; IF([.F51]<7; 2; 1)) -> 1 | AK51: 1 | AL51: 1 | AM51: 50
A52: Black Hole Collector | B52: EG | C52: Building | E52: Pay X Anima. Gain 2 Trade for each Anima paid | F52: 8 | I52: of:=CEILING([.F52]/2;1) -> 4 | J52: 1 | K52: 2 | R52: 3 | AE52: of:=IF([.W52]>0;[.AO$7]*[.W52];0)+IF([.W52]>0;[.AO$19];1)*IF([.R52]>0;[.R52];1)*IF([.AB52]=1;[.AB52]*[.AO$26];1)*(IF([.Z52]>0;[.AO$22];1)*([.J52]*[.AO$7]+[.K52]*[.AO$8]+[.L52]*[.AO$9]+[.N52]*[.AO$10]+[.O52]*[.AO$12]+[.P52]*[.AO$13]+[.S52]*[.AO$15]+[.T52]*[.AO$16]+[.U52]*[.AO$17]+[.V52]*[.AO$18]+[.X52]*[.AO$20])+[.Q52]*[.AO$14]+[.Y52]*[.AO$21]+[.AD52]*[.AO$27]) -> 4.5 | AF52: of:=[.AE52]+[.I52]-IF([.W52]>0;0;[.F52]+[.G52]+[.H52]) -> 0.5 | AG52: of:=[.AF52] -> 0.5 | AJ52: of:=IF([.F52]<5; 3; IF([.F52]<7; 2; 1)) -> 1 | AK52: 1 | AM52: 51
A53: Vega High Command | B53: EG | C53: Building | E53: You may pay 3 less Trade and 3 less Strength for each God assimilated this turn | F53: 9 | I53: of:=CEILING([.F53]/2;1) -> 5 | K53: 3 | L53: 3 | AD53: 1 | AE53: of:=IF([.W53]>0;[.AO$7]*[.W53];0)+IF([.W53]>0;[.AO$19];1)*IF([.R53]>0;[.R53];1)*IF([.AB53]=1;[.AB53]*[.AO$26];1)*(IF([.Z53]>0;[.AO$22];1)*([.J53]*[.AO$7]+[.K53]*[.AO$8]+[.L53]*[.AO$9]+[.N53]*[.AO$10]+[.O53]*[.AO$12]+[.P53]*[.AO$13]+[.S53]*[.AO$15]+[.T53]*[.AO$16]+[.U53]*[.AO$17]+[.V53]*[.AO$18]+[.X53]*[.AO$20])+[.Q53]*[.AO$14]+[.Y53]*[.AO$21]+[.AD53]*[.AO$27]) -> 7 | AF53: of:=[.AE53]+[.I53]-IF([.W53]>0;0;[.F53]+[.G53]+[.H53]) -> 3 | AG53: of:=[.AF53]+[.AF54] -> 4.2 | AJ53: of:=IF([.F53]<5; 3; IF([.F53]<7; 2; 1)) -> 1 | AK53: 1 | AM53: 52
A54: Ally | B54: EG | C54: Ability | E54: Gain 3 Anima | N54: 3 | AB54: 1 | AE54: of:=IF([.W54]>0;[.AO$7]*[.W54];0)+IF([.W54]>0;[.AO$19];1)*IF([.R54]>0;[.R54];1)*IF([.AB54]=1;[.AB54]*[.AO$26];1)*(IF([.Z54]>0;[.AO$22];1)*([.J54]*[.AO$7]+[.K54]*[.AO$8]+[.L54]*[.AO$9]+[.N54]*[.AO$10]+[.O54]*[.AO$12]+[.P54]*[.AO$13]+[.S54]*[.AO$15]+[.T54]*[.AO$16]+[.U54]*[.AO$17]+[.V54]*[.AO$18]+[.X54]*[.AO$20])+[.Q54]*[.AO$14]+[.Y54]*[.AO$21]+[.AD54]*[.AO$27]) -> 1.2 | AF54: of:=[.AE54]+[.I54]-IF([.W54]>0;0;[.F54]+[.G54]+[.H54]) -> 1.2 | AK54: 1 | AM54: 53
A55: Egyptian Total | J55: of:=SUM([.J40:.J53]) -> 9 | K55: of:=SUM([.K40:.K53]) -> 17 | L55: of:=SUM([.L40:.L53]) -> 9 | N55: of:=SUM([.N40:.N53]) -> 6 | O55: of:=SUM([.O40:.O53]) -> 0 | P55: of:=SUM([.P40:.P53]) -> 0 | Q55: of:=SUM([.Q40:.Q53]) -> 9 | R55: of:=SUM([.R40:.R53]) -> 3 | S55: of:=SUM([.S40:.S53]) -> 0 | T55: of:=SUM([.T40:.T53]) -> 0 | U55: of:=SUM([.U40:.U53]) -> 4 | V55: of:=SUM([.V40:.V53]) -> 0 | W55: of:=SUM([.W40:.W53]) -> 0 | X55: of:=SUM([.X40:.X53]) -> 0 | Y55: of:=SUM([.Y40:.Y53]) -> 0 | Z55: of:=SUM([.Z40:.Z53]) -> 0 | AA55: of:=SUM([.AA40:.AA53]) -> 0 | AB55: of:=SUM([.AB40:.AB53]) -> 3 | AD55: of:=SUM([.AD40:.AD53]) -> 2.5 | AE55: of:=IF([.W55]>0;[.AO$7]*[.W55];0)+IF([.W55]>0;[.AO$19];1)*IF([.R55]>0;[.R55];1)*IF([.AB55]=1;[.AB55]*[.AO$26];1)*(IF([.Z55]>0;[.AO$22];1)*([.J55]*[.AO$7]+[.K55]*[.AO$8]+[.L55]*[.AO$9]+[.N55]*[.AO$10]+[.O55]*[.AO$12]+[.P55]*[.AO$13]+[.S55]*[.AO$15]+[.T55]*[.AO$16]+[.U55]*[.AO$17]+[.V55]*[.AO$18]+[.X55]*[.AO$20])+[.Q55]*[.AO$14]+[.Y55]*[.AO$21]+[.AD55]*[.AO$27]) -> 110.4 | AF55: of:=[.AE55]+[.I55]-IF([.W55]>0;0;[.F55]+[.G55]+[.H55]) -> 110.4 | AG55: of:=[.AF55] -> 110.4 | AJ55: of:=SUM([.AJ40:.AJ54]) -> 23 | AM55: 54
A56: “Micky” Micro Cruiser | B56: DR | C56: Human | E56: Pay 1 Anima to gain 2 Trade OR 2 Strength | F56: 1 | I56: of:=CEILING([.F56]/2;1) -> 1 | J56: 1 | K56: 2 | L56: 2 | Z56: 1 | AE56: of:=IF([.W56]>0;[.AO$7]*[.W56];0)+IF([.W56]>0;[.AO$19];1)*IF([.R56]>0;[.R56];1)*IF([.AB56]=1;[.AB56]*[.AO$26];1)*(IF([.Z56]>0;[.AO$22];1)*([.J56]*[.AO$7]+[.K56]*[.AO$8]+[.L56]*[.AO$9]+[.N56]*[.AO$10]+[.O56]*[.AO$12]+[.P56]*[.AO$13]+[.S56]*[.AO$15]+[.T56]*[.AO$16]+[.U56]*[.AO$17]+[.V56]*[.AO$18]+[.X56]*[.AO$20])+[.Q56]*[.AO$14]+[.Y56]*[.AO$21]+[.AD56]*[.AO$27]) -> 2.1 | AF56: of:=[.AE56]+[.I56]-IF([.W56]>0;0;[.F56]+[.G56]+[.H56]) -> 2.1 | AG56: of:=[.AF56] -> 2.1 | AH56: The copyright force is strong with this one | AJ56: of:=IF([.F56]<5; 3; IF([.F56]<7; 2; 1)) -> 3 | AK56: 1 | AL56: 1 | AM56: 55
A57: Nebulon Warrior | B57: DR | C57: Human | E57: Gain 2 Anima. Retain | F57: 2 | I57: of:=CEILING([.F57]/2;1) -> 1 | N57: 2 | Y57: 1 | AE57: of:=IF([.W57]>0;[.AO$7]*[.W57];0)+IF([.W57]>0;[.AO$19];1)*IF([.R57]>0;[.R57];1)*IF([.AB57]=1;[.AB57]*[.AO$26];1)*(IF([.Z57]>0;[.AO$22];1)*([.J57]*[.AO$7]+[.K57]*[.AO$8]+[.L57]*[.AO$9]+[.N57]*[.AO$10]+[.O57]*[.AO$12]+[.P57]*[.AO$13]+[.S57]*[.AO$15]+[.T57]*[.AO$16]+[.U57]*[.AO$17]+[.V57]*[.AO$18]+[.X57]*[.AO$20])+[.Q57]*[.AO$14]+[.Y57]*[.AO$21]+[.AD57]*[.AO$27]) -> 2.9 | AF57: of:=[.AE57]+[.I57]-IF([.W57]>0;0;[.F57]+[.G57]+[.H57]) -> 1.9 | AG57: of:=[.AF57] -> 1.9 | AJ57: of:=IF([.F57]<5; 3; IF([.F57]<7; 2; 1)) -> 3 | AK57: 1 | AL57: 1 | AM57: 56
A58: Hydra Collector | B58: DR | C58: Human | E58: Pay 1 Anima to gain 2 Trade and you may scrap a card in your hand or discard pile | F58: 3 | I58: of:=CEILING([.F58]/2;1) -> 2 | J58: 1 | K58: 2 | T58: 1 | AE58: of:=IF([.W58]>0;[.AO$7]*[.W58];0)+IF([.W58]>0;[.AO$19];1)*IF([.R58]>0;[.R58];1)*IF([.AB58]=1;[.AB58]*[.AO$26];1)*(IF([.Z58]>0;[.AO$22];1)*([.J58]*[.AO$7]+[.K58]*[.AO$8]+[.L58]*[.AO$9]+[.N58]*[.AO$10]+[.O58]*[.AO$12]+[.P58]*[.AO$13]+[.S58]*[.AO$15]+[.T58]*[.AO$16]+[.U58]*[.AO$17]+[.V58]*[.AO$18]+[.X58]*[.AO$20])+[.Q58]*[.AO$14]+[.Y58]*[.AO$21]+[.AD58]*[.AO$27]) -> 2.65 | AF58: of:=[.AE58]+[.I58]-IF([.W58]>0;0;[.F58]+[.G58]+[.H58]) -> 1.65 | AG58: of:=[.AF58]+[.AF59] -> 1.91 | AJ58: of:=IF([.F58]<5; 3; IF([.F58]<7; 2; 1)) -> 3 | AK58: 1 | AL58: 1 | AM58: 57
A59: Ally | B59: DR | C59: Ability | E59: Pay 1 Anima to scrap a card in your hand or discard pile | J59: 1 | T59: 1 | AB59: 1 | AE59: of:=IF([.W59]>0;[.AO$7]*[.W59];0)+IF([.W59]>0;[.AO$19];1)*IF([.R59]>0;[.R59];1)*IF([.AB59]=1;[.AB59]*[.AO$26];1)*(IF([.Z59]>0;[.AO$22];1)*([.J59]*[.AO$7]+[.K59]*[.AO$8]+[.L59]*[.AO$9]+[.N59]*[.AO$10]+[.O59]*[.AO$12]+[.P59]*[.AO$13]+[.S59]*[.AO$15]+[.T59]*[.AO$16]+[.U59]*[.AO$17]+[.V59]*[.AO$18]+[.X59]*[.AO$20])+[.Q59]*[.AO$14]+[.Y59]*[.AO$21]+[.AD59]*[.AO$27]) -> 0.26 | AF59: of:=[.AE59]+[.I59]-IF([.W59]>0;0;[.F59]+[.G59]+[.H59]) -> 0.26 | AK59: 1 | AM59: 58
A60: Magellan | B60: DR | C60: Building | E60: Gain 1 Anima or 2 Trade | F60: 4 | I60: of:=CEILING([.F60]/2;1) -> 2 | AE60: of:=IF([.W60]>0;[.AO$7]*[.W60];0)+IF([.W60]>0;[.AO$19];1)*IF([.R60]>0;[.R60];1)*IF([.AB60]=1;[.AB60]*[.AO$26];1)*(IF([.Z60]>0;[.AO$22];1)*([.J60]*[.AO$7]+[.K60]*[.AO$8]+[.L60]*[.AO$9]+[.N60]*[.AO$10]+[.O60]*[.AO$12]+[.P60]*[.AO$13]+[.S60]*[.AO$15]+[.T60]*[.AO$16]+[.U60]*[.AO$17]+[.V60]*[.AO$18]+[.X60]*[.AO$20])+[.Q60]*[.AO$14]+[.Y60]*[.AO$21]+[.AD60]*[.AO$27]) -> 0 | AF60: of:=[.AE60]+[.I60]-IF([.W60]>0;0;[.F60]+[.G60]+[.H60]) -> -2 | AG60: of:=[.AF60] -> -2 | AJ60: of:=IF([.F60]<5; 3; IF([.F60]<7; 2; 1)) -> 3 | AK60: 1 | AM60: 59
B61: DR | C61: Human | E61: Empower. Gain 3 Trade or 2 Anima | F61: 4 | I61: of:=CEILING([.F61]/2;1) -> 2 | K61: 3 | N61: 2 | Y61: 1 | Z61: 1 | AE61: of:=IF([.W61]>0;[.AO$7]*[.W61];0)+IF([.W61]>0;[.AO$19];1)*IF([.R61]>0;[.R61];1)*IF([.AB61]=1;[.AB61]*[.AO$26];1)*(IF([.Z61]>0;[.AO$22];1)*([.J61]*[.AO$7]+[.K61]*[.AO$8]+[.L61]*[.AO$9]+[.N61]*[.AO$10]+[.O61]*[.AO$12]+[.P61]*[.AO$13]+[.S61]*[.AO$15]+[.T61]*[.AO$16]+[.U61]*[.AO$17]+[.V61]*[.AO$18]+[.X61]*[.AO$20])+[.Q61]*[.AO$14]+[.Y61]*[.AO$21]+[.AD61]*[.AO$27]) -> 3.9 | AF61: of:=[.AE61]+[.I61]-IF([.W61]>0;0;[.F61]+[.G61]+[.H61]) -> 1.9 | AG61: of:=[.AF61]+[.AF62] -> 2.3 | AJ61: of:=IF([.F61]<5; 3; IF([.F61]<7; 2; 1)) -> 3 | AK61: 1 | AM61: 60
B62: DR | C62: Ability | E62: Gain 1 Anima | N62: 1 | AB62: 1 | AE62: of:=IF([.W62]>0;[.AO$7]*[.W62];0)+IF([.W62]>0;[.AO$19];1)*IF([.R62]>0;[.R62];1)*IF([.AB62]=1;[.AB62]*[.AO$26];1)*(IF([.Z62]>0;[.AO$22];1)*([.J62]*[.AO$7]+[.K62]*[.AO$8]+[.L62]*[.AO$9]+[.N62]*[.AO$10]+[.O62]*[.AO$12]+[.P62]*[.AO$13]+[.S62]*[.AO$15]+[.T62]*[.AO$16]+[.U62]*[.AO$17]+[.V62]*[.AO$18]+[.X62]*[.AO$20])+[.Q62]*[.AO$14]+[.Y62]*[.AO$21]+[.AD62]*[.AO$27]) -> 0.4 | AF62: of:=[.AE62]+[.I62]-IF([.W62]>0;0;[.F62]+[.G62]+[.H62]) -> 0.4 | AJ62: of:=IF([.F62]<5; 3; IF([.F62]<7; 2; 1)) -> 3 | AK62: 1 | AM62: 61
B63: DR | E63: Pay 2 Anima to gain 3 Trade or 4 Strength | F63: 5 | I63: of:=CEILING([.F63]/2;1) -> 3 | J63: 2 | K63: 3 | L63: 4 | Z63: 1 | AE63: of:=IF([.W63]>0;[.AO$7]*[.W63];0)+IF([.W63]>0;[.AO$19];1)*IF([.R63]>0;[.R63];1)*IF([.AB63]=1;[.AB63]*[.AO$26];1)*(IF([.Z63]>0;[.AO$22];1)*([.J63]*[.AO$7]+[.K63]*[.AO$8]+[.L63]*[.AO$9]+[.N63]*[.AO$10]+[.O63]*[.AO$12]+[.P63]*[.AO$13]+[.S63]*[.AO$15]+[.T63]*[.AO$16]+[.U63]*[.AO$17]+[.V63]*[.AO$18]+[.X63]*[.AO$20])+[.Q63]*[.AO$14]+[.Y63]*[.AO$21]+[.AD63]*[.AO$27]) -> 3.6 | AF63: of:=[.AE63]+[.I63]-IF([.W63]>0;0;[.F63]+[.G63]+[.H63]) -> 1.6 | AG63: of:=[.AF63] -> 1.6 | AJ63: of:=IF([.F63]<5; 3; IF([.F63]<7; 2; 1)) -> 2 | AK63: 1 | AM63: 62
B64: DR | F64: 6 | I64: of:=CEILING([.F64]/2;1) -> 3 | AE64: of:=IF([.W64]>0;[.AO$7]*[.W64];0)+IF([.W64]>0;[.AO$19];1)*IF([.R64]>0;[.R64];1)*IF([.AB64]=1;[.AB64]*[.AO$26];1)*(IF([.Z64]>0;[.AO$22];1)*([.J64]*[.AO$7]+[.K64]*[.AO$8]+[.L64]*[.AO$9]+[.N64]*[.AO$10]+[.O64]*[.AO$12]+[.P64]*[.AO$13]+[.S64]*[.AO$15]+[.T64]*[.AO$16]+[.U64]*[.AO$17]+[.V64]*[.AO$18]+[.X64]*[.AO$20])+[.Q64]*[.AO$14]+[.Y64]*[.AO$21]+[.AD64]*[.AO$27]) -> 0 | AF64: of:=[.AE64]+[.I64]-IF([.W64]>0;0;[.F64]+[.G64]+[.H64]) -> -3 | AG64: of:=[.AF64] -> -3 | AJ64: of:=IF([.F64]<5; 3; IF([.F64]<7; 2; 1)) -> 2 | AK64: 1 | AM64: 63
B65: DR | F65: 7 | I65: of:=CEILING([.F65]/2;1) -> 4 | AE65: of:=IF([.W65]>0;[.AO$7]*[.W65];0)+IF([.W65]>0;[.AO$19];1)*IF([.R65]>0;[.R65];1)*IF([.AB65]=1;[.AB65]*[.AO$26];1)*(IF([.Z65]>0;[.AO$22];1)*([.J65]*[.AO$7]+[.K65]*[.AO$8]+[.L65]*[.AO$9]+[.N65]*[.AO$10]+[.O65]*[.AO$12]+[.P65]*[.AO$13]+[.S65]*[.AO$15]+[.T65]*[.AO$16]+[.U65]*[.AO$17]+[.V65]*[.AO$18]+[.X65]*[.AO$20])+[.Q65]*[.AO$14]+[.Y65]*[.AO$21]+[.AD65]*[.AO$27]) -> 0 | AF65: of:=[.AE65]+[.I65]-IF([.W65]>0;0;[.F65]+[.G65]+[.H65]) -> -3 | AG65: of:=[.AF65] -> -3 | AJ65: of:=IF([.F65]<5; 3; IF([.F65]<7; 2; 1)) -> 1 | AK65: 1 | AM65: 64
B66: DR | F66: 8 | I66: of:=CEILING([.F66]/2;1) -> 4 | AE66: of:=IF([.W66]>0;[.AO$7]*[.W66];0)+IF([.W66]>0;[.AO$19];1)*IF([.R66]>0;[.R66];1)*IF([.AB66]=1;[.AB66]*[.AO$26];1)*(IF([.Z66]>0;[.AO$22];1)*([.J66]*[.AO$7]+[.K66]*[.AO$8]+[.L66]*[.AO$9]+[.N66]*[.AO$10]+[.O66]*[.AO$12]+[.P66]*[.AO$13]+[.S66]*[.AO$15]+[.T66]*[.AO$16]+[.U66]*[.AO$17]+[.V66]*[.AO$18]+[.X66]*[.AO$20])+[.Q66]*[.AO$14]+[.Y66]*[.AO$21]+[.AD66]*[.AO$27]) -> 0 | AF66: of:=[.AE66]+[.I66]-IF([.W66]>0;0;[.F66]+[.G66]+[.H66]) -> -4 | AG66: of:=[.AF66] -> -4 | AJ66: of:=IF([.F66]<5; 3; IF([.F66]<7; 2; 1)) -> 1 | AK66: 1 | AM66: 65
B67: DR | C67: Human | E67: Assimilate any God for free | F67: 9 | I67: of:=CEILING([.F67]/2;1) -> 5 | AD67: of:=[.I95]*1.25 -> 15.46875 | AE67: of:=IF([.W67]>0;[.AO$7]*[.W67];0)+IF([.W67]>0;[.AO$19];1)*IF([.R67]>0;[.R67];1)*IF([.AB67]=1;[.AB67]*[.AO$26];1)*(IF([.Z67]>0;[.AO$22];1)*([.J67]*[.AO$7]+[.K67]*[.AO$8]+[.L67]*[.AO$9]+[.N67]*[.AO$10]+[.O67]*[.AO$12]+[.P67]*[.AO$13]+[.S67]*[.AO$15]+[.T67]*[.AO$16]+[.U67]*[.AO$17]+[.V67]*[.AO$18]+[.X67]*[.AO$20])+[.Q67]*[.AO$14]+[.Y67]*[.AO$21]+[.AD67]*[.AO$27]) -> 15.46875 | AF67: of:=[.AE67]+[.I67]-IF([.W67]>0;0;[.F67]+[.G67]+[.H67]) -> 11.46875 | AG67: of:=[.AF67] -> 11.46875 | AJ67: of:=IF([.F67]<5; 3; IF([.F67]<7; 2; 1)) -> 1 | AK67: 1 | AM67: 66
A68: Druidic Total | J68: of:=SUM([.J56:.J67]) -> 5 | K68: of:=SUM([.K56:.K67]) -> 10 | L68: of:=SUM([.L56:.L67]) -> 6 | N68: of:=SUM([.N56:.N67]) -> 5 | O68: of:=SUM([.O56:.O67]) -> 0 | P68: of:=SUM([.P56:.P67]) -> 0 | Q68: of:=SUM([.Q56:.Q67]) -> 0 | R68: of:=SUM([.R56:.R67]) -> 0 | S68: of:=SUM([.S56:.S67]) -> 0 | T68: of:=SUM([.T56:.T67]) -> 2 | U68: of:=SUM([.U56:.U67]) -> 0 | V68: of:=SUM([.V56:.V67]) -> 0 | W68: of:=SUM([.W56:.W67]) -> 0 | X68: of:=SUM([.X56:.X67]) -> 0 | Y68: of:=SUM([.Y56:.Y67]) -> 2 | Z68: of:=SUM([.Z56:.Z67]) -> 3 | AA68: of:=SUM([.AA56:.AA67]) -> 0 | AB68: of:=SUM([.AB56:.AB67]) -> 2 | AD68: of:=SUM([.AD56:.AD67]) -> 15.46875 | AE68: of:=IF([.W68]>0;[.AO$7]*[.W68];0)+IF([.W68]>0;[.AO$19];1)*IF([.R68]>0;[.R68];1)*IF([.AB68]=1;[.AB68]*[.AO$26];1)*(IF([.Z68]>0;[.AO$22];1)*([.J68]*[.AO$7]+[.K68]*[.AO$8]+[.L68]*[.AO$9]+[.N68]*[.AO$10]+[.O68]*[.AO$12]+[.P68]*[.AO$13]+[.S68]*[.AO$15]+[.T68]*[.AO$16]+[.U68]*[.AO$17]+[.V68]*[.AO$18]+[.X68]*[.AO$20])+[.Q68]*[.AO$14]+[.Y68]*[.AO$21]+[.AD68]*[.AO$27]) -> 29.74875 | AF68: of:=[.AE68]+[.I68]-IF([.W68]>0;0;[.F68]+[.G68]+[.H68]) -> 29.74875 | AG68: of:=[.AF68] -> 29.74875 | AJ68: of:=SUM([.AJ56:.AJ67]) -> 25 | AM68: 67
A69: Gods | AE69: of:=IF([.W69]>0;[.AO$7]*[.W69];0)+IF([.W69]>0;[.AO$19];1)*IF([.R69]>0;[.R69];1)*IF([.AB69]=1;[.AB69]*[.AO$26];1)*(IF([.Z69]>0;[.AO$22];1)*([.J69]*[.AO$7]+[.K69]*[.AO$8]+[.L69]*[.AO$9]+[.N69]*[.AO$10]+[.O69]*[.AO$12]+[.P69]*[.AO$13]+[.S69]*[.AO$15]+[.T69]*[.AO$16]+[.U69]*[.AO$17]+[.V69]*[.AO$18]+[.X69]*[.AO$20])+[.Q69]*[.AO$14]+[.Y69]*[.AO$21]+[.AD69]*[.AO$27]) -> 0 | AF69: of:=[.AE69]+[.I69]-IF([.W69]>0;0;[.F69]+[.G69]+[.H69]) -> 0 | AG69: of:=[.AF69] -> 0 | AM69: 68
A70: Umbria | B70: U | C70: God | D70: Thunder | E70: Endgame: Gain 1 Favor for each other Thunder God you have | H70: 8 | I70: of:=CEILING(([.F70]+[.G70])*0.5+[.H70];1) -> 8 | AE70: of:=IF([.W70]>0;[.AO$7]*[.W70];0)+IF([.W70]>0;[.AO$19];1)*IF([.R70]>0;[.R70];1)*IF([.AB70]=1;[.AB70]*[.AO$26];1)*(IF([.Z70]>0;[.AO$22];1)*([.J70]*[.AO$7]+[.K70]*[.AO$8]+[.L70]*[.AO$9]+[.N70]*[.AO$10]+[.O70]*[.AO$12]+[.P70]*[.AO$13]+[.S70]*[.AO$15]+[.T70]*[.AO$16]+[.U70]*[.AO$17]+[.V70]*[.AO$18]+[.X70]*[.AO$20])+[.Q70]*[.AO$14]+[.Y70]*[.AO$21]+[.AD70]*[.AO$27]) -> 0 | AF70: of:=[.AE70]+[.I70]-IF([.W70]>0;0;[.F70]+[.G70]+[.H70]) -> 0 | AG70: of:=[.AF70] -> 0 | AJ70: 1 | AL70: 1 | AM70: 69
A71: Plutonia | B71: U | C71: God | D71: Wind | E71: Endgame: Gain 1 Favor for each other Wind God you have | G71: 2 | H71: 7 | I71: of:=CEILING(([.F71]+[.G71])*0.5+[.H71];1) -> 8 | AE71: of:=IF([.W71]>0;[.AO$7]*[.W71];0)+IF([.W71]>0;[.AO$19];1)*IF([.R71]>0;[.R71];1)*IF([.AB71]=1;[.AB71]*[.AO$26];1)*(IF([.Z71]>0;[.AO$22];1)*([.J71]*[.AO$7]+[.K71]*[.AO$8]+[.L71]*[.AO$9]+[.N71]*[.AO$10]+[.O71]*[.AO$12]+[.P71]*[.AO$13]+[.S71]*[.AO$15]+[.T71]*[.AO$16]+[.U71]*[.AO$17]+[.V71]*[.AO$18]+[.X71]*[.AO$20])+[.Q71]*[.AO$14]+[.Y71]*[.AO$21]+[.AD71]*[.AO$27]) -> 0 | AF71: of:=[.AE71]+[.I71]-IF([.W71]>0;0;[.F71]+[.G71]+[.H71]) -> -1 | AG71: of:=[.AF71] -> -1 | AI71: Pluto | AJ71: 1 | AL71: 1 | AM71: 70
A72: Ampor | B72: U | C72: God | D72: Fire | E72: Endgame: Gain 1 Favor for each other Fire God you have | F72: 2 | H72: 7 | I72: of:=CEILING(([.F72]+[.G72])*0.5+[.H72];1) -> 8 | AE72: of:=IF([.W72]>0;[.AO$7]*[.W72];0)+IF([.W72]>0;[.AO$19];1)*IF([.R72]>0;[.R72];1)*IF([.AB72]=1;[.AB72]*[.AO$26];1)*(IF([.Z72]>0;[.AO$22];1)*([.J72]*[.AO$7]+[.K72]*[.AO$8]+[.L72]*[.AO$9]+[.N72]*[.AO$10]+[.O72]*[.AO$12]+[.P72]*[.AO$13]+[.S72]*[.AO$15]+[.T72]*[.AO$16]+[.U72]*[.AO$17]+[.V72]*[.AO$18]+[.X72]*[.AO$20])+[.Q72]*[.AO$14]+[.Y72]*[.AO$21]+[.AD72]*[.AO$27]) -> 0 | AF72: of:=[.AE72]+[.I72]-IF([.W72]>0;0;[.F72]+[.G72]+[.H72]) -> -1 | AG72: of:=[.AF72] -> -1 | AJ72: 1 | AL72: 1 | AM72: 71
A73: Galatia | B73: U | C73: God | D73: Sol | E73: Endgame: Gain 1 Favor for each other Sol God you have | F73: 1 | G73: 1 | H73: 7 | I73: of:=CEILING(([.F73]+[.G73])*0.5+[.H73];1) -> 8 | AE73: of:=IF([.W73]>0;[.AO$7]*[.W73];0)+IF([.W73]>0;[.AO$19];1)*IF([.R73]>0;[.R73];1)*IF([.AB73]=1;[.AB73]*[.AO$26];1)*(IF([.Z73]>0;[.AO$22];1)*([.J73]*[.AO$7]+[.K73]*[.AO$8]+[.L73]*[.AO$9]+[.N73]*[.AO$10]+[.O73]*[.AO$12]+[.P73]*[.AO$13]+[.S73]*[.AO$15]+[.T73]*[.AO$16]+[.U73]*[.AO$17]+[.V73]*[.AO$18]+[.X73]*[.AO$20])+[.Q73]*[.AO$14]+[.Y73]*[.AO$21]+[.AD73]*[.AO$27]) -> 0 | AF73: of:=[.AE73]+[.I73]-IF([.W73]>0;0;[.F73]+[.G73]+[.H73]) -> -1 | AG73: of:=[.AF73] -> -1 | AJ73: 1 | AL73: 1 | AM73: 72
A74: Centauri | B74: U | C74: God | D74: Lun | E74: Endgame: Gain 1 Favor for each other Lun God you have | H74: 10 | I74: of:=CEILING(([.F74]+[.G74])*0.5+[.H74];1) -> 10 | AE74: of:=IF([.W74]>0;[.AO$7]*[.W74];0)+IF([.W74]>0;[.AO$19];1)*IF([.R74]>0;[.R74];1)*IF([.AB74]=1;[.AB74]*[.AO$26];1)*(IF([.Z74]>0;[.AO$22];1)*([.J74]*[.AO$7]+[.K74]*[.AO$8]+[.L74]*[.AO$9]+[.N74]*[.AO$10]+[.O74]*[.AO$12]+[.P74]*[.AO$13]+[.S74]*[.AO$15]+[.T74]*[.AO$16]+[.U74]*[.AO$17]+[.V74]*[.AO$18]+[.X74]*[.AO$20])+[.Q74]*[.AO$14]+[.Y74]*[.AO$21]+[.AD74]*[.AO$27]) -> 0 | AF74: of:=[.AE74]+[.I74]-IF([.W74]>0;0;[.F74]+[.G74]+[.H74]) -> 0 | AG74: of:=[.AF74] -> 0 | AJ74: 1 | AL74: 1 | AM74: 73
A75: Chamaeleontis | B75: U | C75: God | D75: Thunder | E75: Endgame: Gain 1 Favor for each other Thunder God you have | G75: 3 | H75: 8 | I75: of:=CEILING(([.F75]+[.G75])*0.5+[.H75];1) -> 10 | AE75: of:=IF([.W75]>0;[.AO$7]*[.W75];0)+IF([.W75]>0;[.AO$19];1)*IF([.R75]>0;[.R75];1)*IF([.AB75]=1;[.AB75]*[.AO$26];1)*(IF([.Z75]>0;[.AO$22];1)*([.J75]*[.AO$7]+[.K75]*[.AO$8]+[.L75]*[.AO$9]+[.N75]*[.AO$10]+[.O75]*[.AO$12]+[.P75]*[.AO$13]+[.S75]*[.AO$15]+[.T75]*[.AO$16]+[.U75]*[.AO$17]+[.V75]*[.AO$18]+[.X75]*[.AO$20])+[.Q75]*[.AO$14]+[.Y75]*[.AO$21]+[.AD75]*[.AO$27]) -> 0 | AF75: of:=[.AE75]+[.I75]-IF([.W75]>0;0;[.F75]+[.G75]+[.H75]) -> -1 | AG75: of:=[.AF75] -> -1 | AJ75: 1 | AL75: 1 | AM75: 74
A76: Aldebaran | B76: U | C76: God | D76: Wind | E76: Endgame: Gain 1 Favor for each other Wind God you have | F76: 3 | H76: 8 | I76: of:=CEILING(([.F76]+[.G76])*0.5+[.H76];1) -> 10 | AE76: of:=IF([.W76]>0;[.AO$7]*[.W76];0)+IF([.W76]>0;[.AO$19];1)*IF([.R76]>0;[.R76];1)*IF([.AB76]=1;[.AB76]*[.AO$26];1)*(IF([.Z76]>0;[.AO$22];1)*([.J76]*[.AO$7]+[.K76]*[.AO$8]+[.L76]*[.AO$9]+[.N76]*[.AO$10]+[.O76]*[.AO$12]+[.P76]*[.AO$13]+[.S76]*[.AO$15]+[.T76]*[.AO$16]+[.U76]*[.AO$17]+[.V76]*[.AO$18]+[.X76]*[.AO$20])+[.Q76]*[.AO$14]+[.Y76]*[.AO$21]+[.AD76]*[.AO$27]) -> 0 | AF76: of:=[.AE76]+[.I76]-IF([.W76]>0;0;[.F76]+[.G76]+[.H76]) -> -1 | AG76: of:=[.AF76] -> -1 | AJ76: 1 | AL76: 1 | AM76: 75
A77: Hermes | B77: U | C77: God | D77: Fire | E77: Endgame: Gain 1 Favor for each other Fire God you have | F77: 2 | G77: 2 | H77: 8 | I77: of:=CEILING(([.F77]+[.G77])*0.5+[.H77];1) -> 10 | AE77: of:=IF([.W77]>0;[.AO$7]*[.W77];0)+IF([.W77]>0;[.AO$19];1)*IF([.R77]>0;[.R77];1)*IF([.AB77]=1;[.AB77]*[.AO$26];1)*(IF([.Z77]>0;[.AO$22];1)*([.J77]*[.AO$7]+[.K77]*[.AO$8]+[.L77]*[.AO$9]+[.N77]*[.AO$10]+[.O77]*[.AO$12]+[.P77]*[.AO$13]+[.S77]*[.AO$15]+[.T77]*[.AO$16]+[.U77]*[.AO$17]+[.V77]*[.AO$18]+[.X77]*[.AO$20])+[.Q77]*[.AO$14]+[.Y77]*[.AO$21]+[.AD77]*[.AO$27]) -> 0 | AF77: of:=[.AE77]+[.I77]-IF([.W77]>0;0;[.F77]+[.G77]+[.H77]) -> -2 | AG77: of:=[.AF77] -> -2 | AI77: Mercury | AJ77: 1 | AL77: 1 | AM77: 76
A78: Inanna | B78: U | C78: God | D78: Sol | E78: Endgame: Gain 1 Favor for each other Sol God you have | H78: 11 | I78: of:=CEILING(([.F78]+[.G78])*0.5+[.H78];1) -> 11 | AE78: of:=IF([.W78]>0;[.AO$7]*[.W78];0)+IF([.W78]>0;[.AO$19];1)*IF([.R78]>0;[.R78];1)*IF([.AB78]=1;[.AB78]*[.AO$26];1)*(IF([.Z78]>0;[.AO$22];1)*([.J78]*[.AO$7]+[.K78]*[.AO$8]+[.L78]*[.AO$9]+[.N78]*[.AO$10]+[.O78]*[.AO$12]+[.P78]*[.AO$13]+[.S78]*[.AO$15]+[.T78]*[.AO$16]+[.U78]*[.AO$17]+[.V78]*[.AO$18]+[.X78]*[.AO$20])+[.Q78]*[.AO$14]+[.Y78]*[.AO$21]+[.AD78]*[.AO$27]) -> 0 | AF78: of:=[.AE78]+[.I78]-IF([.W78]>0;0;[.F78]+[.G78]+[.H78]) -> 0 | AG78: of:=[.AF78] -> 0 | AI78: Venus | AJ78: 1 | AL78: 1 | AM78: 77
A79: Gaia | B79: U | C79: God | D79: Lun | E79: Endgame: Gain 1 Favor for each other Lun God you have | G79: 4 | H79: 9 | I79: of:=CEILING(([.F79]+[.G79])*0.5+[.H79];1) -> 11 | AE79: of:=IF([.W79]>0;[.AO$7]*[.W79];0)+IF([.W79]>0;[.AO$19];1)*IF([.R79]>0;[.R79];1)*IF([.AB79]=1;[.AB79]*[.AO$26];1)*(IF([.Z79]>0;[.AO$22];1)*([.J79]*[.AO$7]+[.K79]*[.AO$8]+[.L79]*[.AO$9]+[.N79]*[.AO$10]+[.O79]*[.AO$12]+[.P79]*[.AO$13]+[.S79]*[.AO$15]+[.T79]*[.AO$16]+[.U79]*[.AO$17]+[.V79]*[.AO$18]+[.X79]*[.AO$20])+[.Q79]*[.AO$14]+[.Y79]*[.AO$21]+[.AD79]*[.AO$27]) -> 0 | AF79: of:=[.AE79]+[.I79]-IF([.W79]>0;0;[.F79]+[.G79]+[.H79]) -> -2 | AG79: of:=[.AF79] -> -2 | AI79: Earth | AJ79: 1 | AL79: 1 | AM79: 78
A80: Ares | B80: U | C80: God | D80: Thunder | E80: Endgame: Gain 1 Favor for each other Thunder God you have | F80: 4 | H80: 9 | I80: of:=CEILING(([.F80]+[.G80])*0.5+[.H80];1) -> 11 | AE80: of:=IF([.W80]>0;[.AO$7]*[.W80];0)+IF([.W80]>0;[.AO$19];1)*IF([.R80]>0;[.R80];1)*IF([.AB80]=1;[.AB80]*[.AO$26];1)*(IF([.Z80]>0;[.AO$22];1)*([.J80]*[.AO$7]+[.K80]*[.AO$8]+[.L80]*[.AO$9]+[.N80]*[.AO$10]+[.O80]*[.AO$12]+[.P80]*[.AO$13]+[.S80]*[.AO$15]+[.T80]*[.AO$16]+[.U80]*[.AO$17]+[.V80]*[.AO$18]+[.X80]*[.AO$20])+[.Q80]*[.AO$14]+[.Y80]*[.AO$21]+[.AD80]*[.AO$27]) -> 0 | AF80: of:=[.AE80]+[.I80]-IF([.W80]>0;0;[.F80]+[.G80]+[.H80]) -> -2 | AG80: of:=[.AF80] -> -2 | AI80: Mars | AJ80: 1 | AL80: 1 | AM80: 79
A81: Cassiopeia | B81: U | C81: God | D81: Wind | E81: Endgame: Gain 1 Favor for each other Wind God you have | F81: 2 | G81: 2 | H81: 9 | I81: of:=CEILING(([.F81]+[.G81])*0.5+[.H81];1) -> 11 | AE81: of:=IF([.W81]>0;[.AO$7]*[.W81];0)+IF([.W81]>0;[.AO$19];1)*IF([.R81]>0;[.R81];1)*IF([.AB81]=1;[.AB81]*[.AO$26];1)*(IF([.Z81]>0;[.AO$22];1)*([.J81]*[.AO$7]+[.K81]*[.AO$8]+[.L81]*[.AO$9]+[.N81]*[.AO$10]+[.O81]*[.AO$12]+[.P81]*[.AO$13]+[.S81]*[.AO$15]+[.T81]*[.AO$16]+[.U81]*[.AO$17]+[.V81]*[.AO$18]+[.X81]*[.AO$20])+[.Q81]*[.AO$14]+[.Y81]*[.AO$21]+[.AD81]*[.AO$27]) -> 0 | AF81: of:=[.AE81]+[.I81]-IF([.W81]>0;0;[.F81]+[.G81]+[.H81]) -> -2 | AG81: of:=[.AF81] -> -2 | AJ81: 1 | AL81: 1 | AM81: 80
A82: Ra | B82: U | C82: God | D82: Fire | E82: Endgame: Gain 1 Favor for each other Fire God you have | H82: 13 | I82: of:=CEILING(([.F82]+[.G82])*0.5+[.H82];1) -> 13 | AE82: of:=IF([.W82]>0;[.AO$7]*[.W82];0)+IF([.W82]>0;[.AO$19];1)*IF([.R82]>0;[.R82];1)*IF([.AB82]=1;[.AB82]*[.AO$26];1)*(IF([.Z82]>0;[.AO$22];1)*([.J82]*[.AO$7]+[.K82]*[.AO$8]+[.L82]*[.AO$9]+[.N82]*[.AO$10]+[.O82]*[.AO$12]+[.P82]*[.AO$13]+[.S82]*[.AO$15]+[.T82]*[.AO$16]+[.U82]*[.AO$17]+[.V82]*[.AO$18]+[.X82]*[.AO$20])+[.Q82]*[.AO$14]+[.Y82]*[.AO$21]+[.AD82]*[.AO$27]) -> 0 | AF82: of:=[.AE82]+[.I82]-IF([.W82]>0;0;[.F82]+[.G82]+[.H82]) -> 0 | AG82: of:=[.AF82] -> 0 | AI82: Jupiter | AJ82: 1 | AL82: 1 | AM82: 81
A83: Cronus | B83: U | C83: God | D83: Sol | E83: Endgame: Gain 1 Favor for each other Sol God you have | G83: 5 | H83: 10 | I83: of:=CEILING(([.F83]+[.G83])*0.5+[.H83];1) -> 13 | AE83: of:=IF([.W83]>0;[.AO$7]*[.W83];0)+IF([.W83]>0;[.AO$19];1)*IF([.R83]>0;[.R83];1)*IF([.AB83]=1;[.AB83]*[.AO$26];1)*(IF([.Z83]>0;[.AO$22];1)*([.J83]*[.AO$7]+[.K83]*[.AO$8]+[.L83]*[.AO$9]+[.N83]*[.AO$10]+[.O83]*[.AO$12]+[.P83]*[.AO$13]+[.S83]*[.AO$15]+[.T83]*[.AO$16]+[.U83]*[.AO$17]+[.V83]*[.AO$18]+[.X83]*[.AO$20])+[.Q83]*[.AO$14]+[.Y83]*[.AO$21]+[.AD83]*[.AO$27]) -> 0 | AF83: of:=[.AE83]+[.I83]-IF([.W83]>0;0;[.F83]+[.G83]+[.H83]) -> -2 | AG83: of:=[.AF83] -> -2 | AI83: Saturn | AJ83: 1 | AL83: 1 | AM83: 82
A84: Caelus | B84: U | C84: God | D84: Lun | E84: Endgame: Gain 1 Favor for each other Lun God you have | F84: 5 | H84: 10 | I84: of:=CEILING(([.F84]+[.G84])*0.5+[.H84];1) -> 13 | AE84: of:=IF([.W84]>0;[.AO$7]*[.W84];0)+IF([.W84]>0;[.AO$19];1)*IF([.R84]>0;[.R84];1)*IF([.AB84]=1;[.AB84]*[.AO$26];1)*(IF([.Z84]>0;[.AO$22];1)*([.J84]*[.AO$7]+[.K84]*[.AO$8]+[.L84]*[.AO$9]+[.N84]*[.AO$10]+[.O84]*[.AO$12]+[.P84]*[.AO$13]+[.S84]*[.AO$15]+[.T84]*[.AO$16]+[.U84]*[.AO$17]+[.V84]*[.AO$18]+[.X84]*[.AO$20])+[.Q84]*[.AO$14]+[.Y84]*[.AO$21]+[.AD84]*[.AO$27]) -> 0 | AF84: of:=[.AE84]+[.I84]-IF([.W84]>0;0;[.F84]+[.G84]+[.H84]) -> -2 | AG84: of:=[.AF84] -> -2 | AI84: Uranus | AJ84: 1 | AL84: 1 | AM84: 83
A85: Andromeda | B85: U | C85: God | D85: Thunder | E85: Endgame: Gain 1 Favor for each other Thunder God you have | F85: 3 | G85: 3 | H85: 10 | I85: of:=CEILING(([.F85]+[.G85])*0.5+[.H85];1) -> 13 | AE85: of:=IF([.W85]>0;[.AO$7]*[.W85];0)+IF([.W85]>0;[.AO$19];1)*IF([.R85]>0;[.R85];1)*IF([.AB85]=1;[.AB85]*[.AO$26];1)*(IF([.Z85]>0;[.AO$22];1)*([.J85]*[.AO$7]+[.K85]*[.AO$8]+[.L85]*[.AO$9]+[.N85]*[.AO$10]+[.O85]*[.AO$12]+[.P85]*[.AO$13]+[.S85]*[.AO$15]+[.T85]*[.AO$16]+[.U85]*[.AO$17]+[.V85]*[.AO$18]+[.X85]*[.AO$20])+[.Q85]*[.AO$14]+[.Y85]*[.AO$21]+[.AD85]*[.AO$27]) -> 0 | AF85: of:=[.AE85]+[.I85]-IF([.W85]>0;0;[.F85]+[.G85]+[.H85]) -> -3 | AG85: of:=[.AF85] -> -3 | AJ85: 1 | AL85: 1 | AM85: 84
A86: Poseidon | B86: U | C86: God | D86: Wind | E86: Endgame: Gain 1 Favor for each other Wind God you have | H86: 14 | I86: of:=CEILING(([.F86]+[.G86])*0.5+[.H86];1) -> 14 | AE86: of:=IF([.W86]>0;[.AO$7]*[.W86];0)+IF([.W86]>0;[.AO$19];1)*IF([.R86]>0;[.R86];1)*IF([.AB86]=1;[.AB86]*[.AO$26];1)*(IF([.Z86]>0;[.AO$22];1)*([.J86]*[.AO$7]+[.K86]*[.AO$8]+[.L86]*[.AO$9]+[.N86]*[.AO$10]+[.O86]*[.AO$12]+[.P86]*[.AO$13]+[.S86]*[.AO$15]+[.T86]*[.AO$16]+[.U86]*[.AO$17]+[.V86]*[.AO$18]+[.X86]*[.AO$20])+[.Q86]*[.AO$14]+[.Y86]*[.AO$21]+[.AD86]*[.AO$27]) -> 0 | AF86: of:=[.AE86]+[.I86]-IF([.W86]>0;0;[.F86]+[.G86]+[.H86]) -> 0 | AG86: of:=[.AF86] -> 0 | AI86: Neptune | AJ86: 1 | AL86: 1 | AM86: 85
A87: Demeter | B87: U | C87: God | D87: Fire | E87: Endgame: Gain 1 Favor for each other Fire God you have | G87: 6 | H87: 11 | I87: of:=CEILING(([.F87]+[.G87])*0.5+[.H87];1) -> 14 | AE87: of:=IF([.W87]>0;[.AO$7]*[.W87];0)+IF([.W87]>0;[.AO$19];1)*IF([.R87]>0;[.R87];1)*IF([.AB87]=1;[.AB87]*[.AO$26];1)*(IF([.Z87]>0;[.AO$22];1)*([.J87]*[.AO$7]+[.K87]*[.AO$8]+[.L87]*[.AO$9]+[.N87]*[.AO$10]+[.O87]*[.AO$12]+[.P87]*[.AO$13]+[.S87]*[.AO$15]+[.T87]*[.AO$16]+[.U87]*[.AO$17]+[.V87]*[.AO$18]+[.X87]*[.AO$20])+[.Q87]*[.AO$14]+[.Y87]*[.AO$21]+[.AD87]*[.AO$27]) -> 0 | AF87: of:=[.AE87]+[.I87]-IF([.W87]>0;0;[.F87]+[.G87]+[.H87]) -> -3 | AG87: of:=[.AF87] -> -3 | AJ87: 1 | AL87: 1 | AM87: 86
A88: Echidna | B88: U | C88: God | D88: Sol | E88: Endgame: Gain 1 Favor for each other Sol God you have | F88: 6 | H88: 11 | I88: of:=CEILING(([.F88]+[.G88])*0.5+[.H88];1) -> 14 | AE88: of:=IF([.W88]>0;[.AO$7]*[.W88];0)+IF([.W88]>0;[.AO$19];1)*IF([.R88]>0;[.R88];1)*IF([.AB88]=1;[.AB88]*[.AO$26];1)*(IF([.Z88]>0;[.AO$22];1)*([.J88]*[.AO$7]+[.K88]*[.AO$8]+[.L88]*[.AO$9]+[.N88]*[.AO$10]+[.O88]*[.AO$12]+[.P88]*[.AO$13]+[.S88]*[.AO$15]+[.T88]*[.AO$16]+[.U88]*[.AO$17]+[.V88]*[.AO$18]+[.X88]*[.AO$20])+[.Q88]*[.AO$14]+[.Y88]*[.AO$21]+[.AD88]*[.AO$27]) -> 0 | AF88: of:=[.AE88]+[.I88]-IF([.W88]>0;0;[.F88]+[.G88]+[.H88]) -> -3 | AG88: of:=[.AF88] -> -3 | AJ88: 1 | AL88: 1 | AM88: 87
A89: Tauri | B89: U | C89: God | D89: Lun | E89: Endgame: Gain 1 Favor for each other Lun God you have | F89: 3 | G89: 3 | H89: 11 | I89: of:=CEILING(([.F89]+[.G89])*0.5+[.H89];1) -> 14 | AE89: of:=IF([.W89]>0;[.AO$7]*[.W89];0)+IF([.W89]>0;[.AO$19];1)*IF([.R89]>0;[.R89];1)*IF([.AB89]=1;[.AB89]*[.AO$26];1)*(IF([.Z89]>0;[.AO$22];1)*([.J89]*[.AO$7]+[.K89]*[.AO$8]+[.L89]*[.AO$9]+[.N89]*[.AO$10]+[.O89]*[.AO$12]+[.P89]*[.AO$13]+[.S89]*[.AO$15]+[.T89]*[.AO$16]+[.U89]*[.AO$17]+[.V89]*[.AO$18]+[.X89]*[.AO$20])+[.Q89]*[.AO$14]+[.Y89]*[.AO$21]+[.AD89]*[.AO$27]) -> 0 | AF89: of:=[.AE89]+[.I89]-IF([.W89]>0;0;[.F89]+[.G89]+[.H89]) -> -3 | AG89: of:=[.AF89] -> -3 | AJ89: 1 | AL89: 1 | AM89: 88
A90: Illyria | B90: U | C90: God | D90: Thunder | E90: Endgame: Gain 1 Favor for each other Thunder God you have | H90: 16 | I90: of:=CEILING(([.F90]+[.G90])*0.5+[.H90];1) -> 16 | AE90: of:=IF([.W90]>0;[.AO$7]*[.W90];0)+IF([.W90]>0;[.AO$19];1)*IF([.R90]>0;[.R90];1)*IF([.AB90]=1;[.AB90]*[.AO$26];1)*(IF([.Z90]>0;[.AO$22];1)*([.J90]*[.AO$7]+[.K90]*[.AO$8]+[.L90]*[.AO$9]+[.N90]*[.AO$10]+[.O90]*[.AO$12]+[.P90]*[.AO$13]+[.S90]*[.AO$15]+[.T90]*[.AO$16]+[.U90]*[.AO$17]+[.V90]*[.AO$18]+[.X90]*[.AO$20])+[.Q90]*[.AO$14]+[.Y90]*[.AO$21]+[.AD90]*[.AO$27]) -> 0 | AF90: of:=[.AE90]+[.I90]-IF([.W90]>0;0;[.F90]+[.G90]+[.H90]) -> 0 | AG90: of:=[.AF90] -> 0 | AJ90: 1 | AL90: 1 | AM90: 89
A91: Mira | B91: U | C91: God | D91: Wind | E91: Endgame: Gain 1 Favor for each other Wind God you have | G91: 7 | H91: 12 | I91: of:=CEILING(([.F91]+[.G91])*0.5+[.H91];1) -> 16 | AE91: of:=IF([.W91]>0;[.AO$7]*[.W91];0)+IF([.W91]>0;[.AO$19];1)*IF([.R91]>0;[.R91];1)*IF([.AB91]=1;[.AB91]*[.AO$26];1)*(IF([.Z91]>0;[.AO$22];1)*([.J91]*[.AO$7]+[.K91]*[.AO$8]+[.L91]*[.AO$9]+[.N91]*[.AO$10]+[.O91]*[.AO$12]+[.P91]*[.AO$13]+[.S91]*[.AO$15]+[.T91]*[.AO$16]+[.U91]*[.AO$17]+[.V91]*[.AO$18]+[.X91]*[.AO$20])+[.Q91]*[.AO$14]+[.Y91]*[.AO$21]+[.AD91]*[.AO$27]) -> 0 | AF91: of:=[.AE91]+[.I91]-IF([.W91]>0;0;[.F91]+[.G91]+[.H91]) -> -3 | AG91: of:=[.AF91] -> -3 | AJ91: 1 | AL91: 1 | AM91: 90
A92: Salacia | B92: U | C92: God | D92: Fire | E92: Endgame: Gain 1 Favor for each other Fire God you have | F92: 7 | H92: 12 | I92: of:=CEILING(([.F92]+[.G92])*0.5+[.H92];1) -> 16 | AE92: of:=IF([.W92]>0;[.AO$7]*[.W92];0)+IF([.W92]>0;[.AO$19];1)*IF([.R92]>0;[.R92];1)*IF([.AB92]=1;[.AB92]*[.AO$26];1)*(IF([.Z92]>0;[.AO$22];1)*([.J92]*[.AO$7]+[.K92]*[.AO$8]+[.L92]*[.AO$9]+[.N92]*[.AO$10]+[.O92]*[.AO$12]+[.P92]*[.AO$13]+[.S92]*[.AO$15]+[.T92]*[.AO$16]+[.U92]*[.AO$17]+[.V92]*[.AO$18]+[.X92]*[.AO$20])+[.Q92]*[.AO$14]+[.Y92]*[.AO$21]+[.AD92]*[.AO$27]) -> 0 | AF92: of:=[.AE92]+[.I92]-IF([.W92]>0;0;[.F92]+[.G92]+[.H92]) -> -3 | AG92: of:=[.AF92] -> -3 | AJ92: 1 | AL92: 1 | AM92: 91
A93: Aurora | B93: U | C93: God | D93: Sol | E93: Endgame: Gain 1 Favor for each other Sol God you have | F93: 4 | G93: 4 | H93: 12 | I93: of:=CEILING(([.F93]+[.G93])*0.5+[.H93];1) -> 16 | AE93: of:=IF([.W93]>0;[.AO$7]*[.W93];0)+IF([.W93]>0;[.AO$19];1)*IF([.R93]>0;[.R93];1)*IF([.AB93]=1;[.AB93]*[.AO$26];1)*(IF([.Z93]>0;[.AO$22];1)*([.J93]*[.AO$7]+[.K93]*[.AO$8]+[.L93]*[.AO$9]+[.N93]*[.AO$10]+[.O93]*[.AO$12]+[.P93]*[.AO$13]+[.S93]*[.AO$15]+[.T93]*[.AO$16]+[.U93]*[.AO$17]+[.V93]*[.AO$18]+[.X93]*[.AO$20])+[.Q93]*[.AO$14]+[.Y93]*[.AO$21]+[.AD93]*[.AO$27]) -> 0 | AF93: of:=[.AE93]+[.I93]-IF([.W93]>0;0;[.F93]+[.G93]+[.H93]) -> -4 | AG93: of:=[.AF93] -> -4 | AJ93: 1 | AL93: 1 | AM93: 92
A94: Sirius | B94: U | C94: God | D94: Lun | E94: Endgame: Gain 1 Favor for each other Lun God you have | H94: 17 | I94: of:=CEILING(([.F94]+[.G94])*0.5+[.H94];1) -> 17 | AE94: of:=IF([.W94]>0;[.AO$7]*[.W94];0)+IF([.W94]>0;[.AO$19];1)*IF([.R94]>0;[.R94];1)*IF([.AB94]=1;[.AB94]*[.AO$26];1)*(IF([.Z94]>0;[.AO$22];1)*([.J94]*[.AO$7]+[.K94]*[.AO$8]+[.L94]*[.AO$9]+[.N94]*[.AO$10]+[.O94]*[.AO$12]+[.P94]*[.AO$13]+[.S94]*[.AO$15]+[.T94]*[.AO$16]+[.U94]*[.AO$17]+[.V94]*[.AO$18]+[.X94]*[.AO$20])+[.Q94]*[.AO$14]+[.Y94]*[.AO$21]+[.AD94]*[.AO$27]) -> 0 | AF94: of:=[.AE94]+[.I94]-IF([.W94]>0;0;[.F94]+[.G94]+[.H94]) -> 0 | AG94: of:=[.AF94] -> 0 | AJ94: 1 | AL94: 1 | AM94: 93
A95: God Statistics | F95: of:=SUM([.F71:.F94]) -> 42 | G95: of:=SUM([.G71:.G94]) -> 42 | I95: of:=AVERAGE([.I71:.I94]) -> 12.375 | J95: of:=SUM([.J70:.J94]) -> 0 | K95: of:=SUM([.K70:.K94]) -> 0 | L95: of:=SUM([.L70:.L94]) -> 0 | N95: of:=SUM([.N70:.N94]) -> 0 | O95: of:=SUM([.O70:.O94]) -> 0 | P95: of:=SUM([.P70:.P94]) -> 0 | Q95: of:=SUM([.Q70:.Q94]) -> 0 | R95: of:=SUM([.R70:.R94]) -> 0 | S95: of:=SUM([.S70:.S94]) -> 0 | T95: of:=SUM([.T70:.T94]) -> 0 | U95: of:=SUM([.U70:.U94]) -> 0 | V95: of:=SUM([.V70:.V94]) -> 0 | W95: of:=SUM([.W70:.W94]) -> 0 | X95: of:=SUM([.X70:.X94]) -> 0 | Y95: of:=SUM([.Y70:.Y94]) -> 0 | Z95: of:=SUM([.Z70:.Z94]) -> 0 | AA95: of:=SUM([.AA70:.AA94]) -> 0 | AB95: of:=SUM([.AB70:.AB94]) -> 0 | AC95: of:=SUM([.AC70:.AC94]) -> 0 | AD95: of:=SUM([.AD70:.AD94]) -> 0 | AE95: of:=IF([.W95]>0;[.AO$7]*[.W95];0)+IF([.W95]>0;[.AO$19];1)*IF([.R95]>0;[.R95];1)*IF([.AB95]=1;[.AB95]*[.AO$26];1)*(IF([.Z95]>0;[.AO$22];1)*([.J95]*[.AO$7]+[.K95]*[.AO$8]+[.L95]*[.AO$9]+[.N95]*[.AO$10]+[.O95]*[.AO$12]+[.P95]*[.AO$13]+[.S95]*[.AO$15]+[.T95]*[.AO$16]+[.U95]*[.AO$17]+[.V95]*[.AO$18]+[.X95]*[.AO$20])+[.Q95]*[.AO$14]+[.Y95]*[.AO$21]+[.AD95]*[.AO$27]) -> 0 | AF95: of:=[.AE95]+[.I95]-IF([.W95]>0;0;[.F95]+[.G95]+[.H95]) -> -71.625 | AG95: of:=[.AF95] -> -71.625 | AJ95: of:=SUM([.AJ70:.AJ94]) -> 25 | AM95: 94
G96: of:=[.G95]/[.F95] -> 1 | AE96: of:=IF([.W96]>0;[.AO$7]*[.W96];0)+IF([.W96]>0;[.AO$19];1)*IF([.R96]>0;[.R96];1)*IF([.AB96]=1;[.AB96]*[.AO$26];1)*(IF([.Z96]>0;[.AO$22];1)*([.J96]*[.AO$7]+[.K96]*[.AO$8]+[.L96]*[.AO$9]+[.N96]*[.AO$10]+[.O96]*[.AO$12]+[.P96]*[.AO$13]+[.S96]*[.AO$15]+[.T96]*[.AO$16]+[.U96]*[.AO$17]+[.V96]*[.AO$18]+[.X96]*[.AO$20])+[.Q96]*[.AO$14]+[.Y96]*[.AO$21]+[.AD96]*[.AO$27]) -> 0 | AF96: of:=[.AE96]+[.I96]-IF([.W96]>0;0;[.F96]+[.G96]+[.H96]) -> -1 | AG96: of:=[.AF96] -> -1 | AM96: 95
E97: Most of these Creatures should automatically do damage to Fortifications/Gods roughly equal to their strength. This would balance the game between passive-aggresive and direct modes | AE97: of:=IF([.W97]>0;[.AO$7]*[.W97];0)+IF([.W97]>0;[.AO$19];1)*IF([.R97]>0;[.R97];1)*IF([.AB97]=1;[.AB97]*[.AO$26];1)*(IF([.Z97]>0;[.AO$22];1)*([.J97]*[.AO$7]+[.K97]*[.AO$8]+[.L97]*[.AO$9]+[.N97]*[.AO$10]+[.O97]*[.AO$12]+[.P97]*[.AO$13]+[.S97]*[.AO$15]+[.T97]*[.AO$16]+[.U97]*[.AO$17]+[.V97]*[.AO$18]+[.X97]*[.AO$20])+[.Q97]*[.AO$14]+[.Y97]*[.AO$21]+[.AD97]*[.AO$27]) -> 0 | AF97: of:=[.AE97]+[.I97]-IF([.W97]>0;0;[.F97]+[.G97]+[.H97]) -> 0 | AG97: of:=[.AF97] -> 0 | AM97: 96
A98: Creatures | E98: ~25 of these | AE98: of:=IF([.W98]>0;[.AO$7]*[.W98];0)+IF([.W98]>0;[.AO$19];1)*IF([.R98]>0;[.R98];1)*IF([.AB98]=1;[.AB98]*[.AO$26];1)*(IF([.Z98]>0;[.AO$22];1)*([.J98]*[.AO$7]+[.K98]*[.AO$8]+[.L98]*[.AO$9]+[.N98]*[.AO$10]+[.O98]*[.AO$12]+[.P98]*[.AO$13]+[.S98]*[.AO$15]+[.T98]*[.AO$16]+[.U98]*[.AO$17]+[.V98]*[.AO$18]+[.X98]*[.AO$20])+[.Q98]*[.AO$14]+[.Y98]*[.AO$21]+[.AD98]*[.AO$27]) -> 0 | AF98: of:=[.AE98]+[.I98]-IF([.W98]>0;0;[.F98]+[.G98]+[.H98]) -> 0 | AG98: of:=[.AF98] -> 0 | AM98: 97
A99: Rampaging Rhinoceros | B99: U | C99: Creature | E99: Ongoing Trophy: Once per turn, you may assimilate any God for free | G99: 15 | I99: of:=CEILING(([.F99]+[.G99]+[.H99]) * 0.5; 1) -> 8 | AD99: of:=[.I95]*2 -> 24.75 | AE99: of:=IF([.W99]>0;[.AO$7]*[.W99];0)+IF([.W99]>0;[.AO$19];1)*IF([.R99]>0;[.R99];1)*IF([.AB99]=1;[.AB99]*[.AO$26];1)*(IF([.Z99]>0;[.AO$22];1)*([.J99]*[.AO$7]+[.K99]*[.AO$8]+[.L99]*[.AO$9]+[.N99]*[.AO$10]+[.O99]*[.AO$12]+[.P99]*[.AO$13]+[.S99]*[.AO$15]+[.T99]*[.AO$16]+[.U99]*[.AO$17]+[.V99]*[.AO$18]+[.X99]*[.AO$20])+[.Q99]*[.AO$14]+[.Y99]*[.AO$21]+[.AD99]*[.AO$27]) -> 24.75 | AF99: of:=[.AE99]+[.I99]-IF([.W99]>0;0;[.F99]+[.G99]+[.H99]) -> 17.75 | AG99: of:=[.AF99] -> 17.75 | AJ99: of:=IF([.I99]<5; 3; IF([.I99]<7; 2; 1)) -> 1 | AK99: 1 | AL99: 1 | AM99: 98
A100: Auspicious Auroch | B100: U | C100: Creature | E100: For each opponent, destroy a Fortification or Building of your choosing | G100: 6 | I100: of:=CEILING(([.F100]+[.G100]+[.H100]) * 0.5; 1) -> 3 | AE100: of:=IF([.W100]>0;[.AO$7]*[.W100];0)+IF([.W100]>0;[.AO$19];1)*IF([.R100]>0;[.R100];1)*IF([.AB100]=1;[.AB100]*[.AO$26];1)*(IF([.Z100]>0;[.AO$22];1)*([.J100]*[.AO$7]+[.K100]*[.AO$8]+[.L100]*[.AO$9]+[.N100]*[.AO$10]+[.O100]*[.AO$12]+[.P100]*[.AO$13]+[.S100]*[.AO$15]+[.T100]*[.AO$16]+[.U100]*[.AO$17]+[.V100]*[.AO$18]+[.X100]*[.AO$20])+[.Q100]*[.AO$14]+[.Y100]*[.AO$21]+[.AD100]*[.AO$27]) -> 0 | AF100: of:=[.AE100]+[.I100]-IF([.W100]>0;0;[.F100]+[.G100]+[.H100]) -> -3 | AG100: of:=[.AF100] -> -3 | AJ100: of:=IF([.I100]<5; 3; IF([.I100]<7; 2; 1)) -> 3 | AK100: 1 | AL100: 1 | AM100: 99
A101: Aggressive Alligator | B101: U | C101: Creature | E101: Deal 3 damage to all Buildings and Settlements of a single opponent | G101: 9 | I101: of:=CEILING(([.F101]+[.G101]+[.H101]) * 0.5; 1) -> 5 | AE101: of:=IF([.W101]>0;[.AO$7]*[.W101];0)+IF([.W101]>0;[.AO$19];1)*IF([.R101]>0;[.R101];1)*IF([.AB101]=1;[.AB101]*[.AO$26];1)*(IF([.Z101]>0;[.AO$22];1)*([.J101]*[.AO$7]+[.K101]*[.AO$8]+[.L101]*[.AO$9]+[.N101]*[.AO$10]+[.O101]*[.AO$12]+[.P101]*[.AO$13]+[.S101]*[.AO$15]+[.T101]*[.AO$16]+[.U101]*[.AO$17]+[.V101]*[.AO$18]+[.X101]*[.AO$20])+[.Q101]*[.AO$14]+[.Y101]*[.AO$21]+[.AD101]*[.AO$27]) -> 0 | AF101: of:=[.AE101]+[.I101]-IF([.W101]>0;0;[.F101]+[.G101]+[.H101]) -> -4 | AG101: of:=[.AF101] -> -4 | AJ101: of:=IF([.I101]<5; 3; IF([.I101]<7; 2; 1)) -> 2 | AK101: 1 | AL101: 1 | AM101: 100
A102: Incorrigible Ibex | B102: U | C102: Creature | E102: Each opponent must choose and destroy a Building they have deployed | G102: 6 | I102: of:=CEILING(([.F102]+[.G102]+[.H102]) * 0.5; 1) -> 3 | AE102: of:=IF([.W102]>0;[.AO$7]*[.W102];0)+IF([.W102]>0;[.AO$19];1)*IF([.R102]>0;[.R102];1)*IF([.AB102]=1;[.AB102]*[.AO$26];1)*(IF([.Z102]>0;[.AO$22];1)*([.J102]*[.AO$7]+[.K102]*[.AO$8]+[.L102]*[.AO$9]+[.N102]*[.AO$10]+[.O102]*[.AO$12]+[.P102]*[.AO$13]+[.S102]*[.AO$15]+[.T102]*[.AO$16]+[.U102]*[.AO$17]+[.V102]*[.AO$18]+[.X102]*[.AO$20])+[.Q102]*[.AO$14]+[.Y102]*[.AO$21]+[.AD102]*[.AO$27]) -> 0 | AF102: of:=[.AE102]+[.I102]-IF([.W102]>0;0;[.F102]+[.G102]+[.H102]) -> -3 | AG102: of:=[.AF102] -> -3 | AJ102: of:=IF([.I102]<5; 3; IF([.I102]<7; 2; 1)) -> 3 | AK102: 1 | AL102: 1 | AM102: 101
A103: Chaotic Centipede | B103: U | C103: Creature | E103: Scrap any non-Creatures in the trade row of your choosing | G103: 4 | I103: of:=CEILING(([.F103]+[.G103]+[.H103]) * 0.5; 1) -> 2 | AE103: of:=IF([.W103]>0;[.AO$7]*[.W103];0)+IF([.W103]>0;[.AO$19];1)*IF([.R103]>0;[.R103];1)*IF([.AB103]=1;[.AB103]*[.AO$26];1)*(IF([.Z103]>0;[.AO$22];1)*([.J103]*[.AO$7]+[.K103]*[.AO$8]+[.L103]*[.AO$9]+[.N103]*[.AO$10]+[.O103]*[.AO$12]+[.P103]*[.AO$13]+[.S103]*[.AO$15]+[.T103]*[.AO$16]+[.U103]*[.AO$17]+[.V103]*[.AO$18]+[.X103]*[.AO$20])+[.Q103]*[.AO$14]+[.Y103]*[.AO$21]+[.AD103]*[.AO$27]) -> 0 | AF103: of:=[.AE103]+[.I103]-IF([.W103]>0;0;[.F103]+[.G103]+[.H103]) -> -2 | AG103: of:=[.AF103] -> -2 | AJ103: of:=IF([.I103]<5; 3; IF([.I103]<7; 2; 1)) -> 3 | AK103: 1 | AL103: 1 | AM103: 102
A104: Shiny Collector | B104: U | C104: Creature | E104: Trophy: Acquire all Relics in the trade row | G104: 7 | I104: of:=CEILING(([.F104]+[.G104]+[.H104]) * 0.5; 1) -> 4 | AE104: of:=IF([.W104]>0;[.AO$7]*[.W104];0)+IF([.W104]>0;[.AO$19];1)*IF([.R104]>0;[.R104];1)*IF([.AB104]=1;[.AB104]*[.AO$26];1)*(IF([.Z104]>0;[.AO$22];1)*([.J104]*[.AO$7]+[.K104]*[.AO$8]+[.L104]*[.AO$9]+[.N104]*[.AO$10]+[.O104]*[.AO$12]+[.P104]*[.AO$13]+[.S104]*[.AO$15]+[.T104]*[.AO$16]+[.U104]*[.AO$17]+[.V104]*[.AO$18]+[.X104]*[.AO$20])+[.Q104]*[.AO$14]+[.Y104]*[.AO$21]+[.AD104]*[.AO$27]) -> 0 | AF104: of:=[.AE104]+[.I104]-IF([.W104]>0;0;[.F104]+[.G104]+[.H104]) -> -3 | AG104: of:=[.AF104] -> -3 | AJ104: of:=IF([.I104]<5; 3; IF([.I104]<7; 2; 1)) -> 3 | AK104: 1 | AM104: 103
A105: Titanic Turtle | B105: U | C105: Creature | E105: Deal 5 damage to all Settlements of a single opponent | G105: 7 | I105: of:=CEILING(([.F105]+[.G105]+[.H105]) * 0.5; 1) -> 4 | AE105: of:=IF([.W105]>0;[.AO$7]*[.W105];0)+IF([.W105]>0;[.AO$19];1)*IF([.R105]>0;[.R105];1)*IF([.AB105]=1;[.AB105]*[.AO$26];1)*(IF([.Z105]>0;[.AO$22];1)*([.J105]*[.AO$7]+[.K105]*[.AO$8]+[.L105]*[.AO$9]+[.N105]*[.AO$10]+[.O105]*[.AO$12]+[.P105]*[.AO$13]+[.S105]*[.AO$15]+[.T105]*[.AO$16]+[.U105]*[.AO$17]+[.V105]*[.AO$18]+[.X105]*[.AO$20])+[.Q105]*[.AO$14]+[.Y105]*[.AO$21]+[.AD105]*[.AO$27]) -> 0 | AF105: of:=[.AE105]+[.I105]-IF([.W105]>0;0;[.F105]+[.G105]+[.H105]) -> -3 | AG105: of:=[.AF105] -> -3 | AJ105: of:=IF([.I105]<5; 3; IF([.I105]<7; 2; 1)) -> 3 | AK105: 1 | AL105: 1 | AM105: 104
A106: Sluggish Sloth | B106: U | C106: Creature | E106: Defeat the highest cost Building of each opponent | G106: 10 | I106: of:=CEILING(([.F106]+[.G106]+[.H106]) * 0.5; 1) -> 5 | AE106: of:=IF([.W106]>0;[.AO$7]*[.W106];0)+IF([.W106]>0;[.AO$19];1)*IF([.R106]>0;[.R106];1)*IF([.AB106]=1;[.AB106]*[.AO$26];1)*(IF([.Z106]>0;[.AO$22];1)*([.J106]*[.AO$7]+[.K106]*[.AO$8]+[.L106]*[.AO$9]+[.N106]*[.AO$10]+[.O106]*[.AO$12]+[.P106]*[.AO$13]+[.S106]*[.AO$15]+[.T106]*[.AO$16]+[.U106]*[.AO$17]+[.V106]*[.AO$18]+[.X106]*[.AO$20])+[.Q106]*[.AO$14]+[.Y106]*[.AO$21]+[.AD106]*[.AO$27]) -> 0 | AF106: of:=[.AE106]+[.I106]-IF([.W106]>0;0;[.F106]+[.G106]+[.H106]) -> -5 | AG106: of:=[.AF106] -> -5 | AJ106: of:=IF([.I106]<5; 3; IF([.I106]<7; 2; 1)) -> 2 | AK106: 1 | AL106: 1 | AM106: 105
A107: Demonic Dodo | B107: U | C107: Creature | E107: Trophy: Draw 2 Cards | G107: 5 | I107: of:=CEILING(([.F107]+[.G107]+[.H107]) * 0.5; 1) -> 3 | AE107: of:=IF([.W107]>0;[.AO$7]*[.W107];0)+IF([.W107]>0;[.AO$19];1)*IF([.R107]>0;[.R107];1)*IF([.AB107]=1;[.AB107]*[.AO$26];1)*(IF([.Z107]>0;[.AO$22];1)*([.J107]*[.AO$7]+[.K107]*[.AO$8]+[.L107]*[.AO$9]+[.N107]*[.AO$10]+[.O107]*[.AO$12]+[.P107]*[.AO$13]+[.S107]*[.AO$15]+[.T107]*[.AO$16]+[.U107]*[.AO$17]+[.V107]*[.AO$18]+[.X107]*[.AO$20])+[.Q107]*[.AO$14]+[.Y107]*[.AO$21]+[.AD107]*[.AO$27]) -> 0 | AF107: of:=[.AE107]+[.I107]-IF([.W107]>0;0;[.F107]+[.G107]+[.H107]) -> -2 | AG107: of:=[.AF107] -> -2 | AJ107: of:=IF([.I107]<5; 3; IF([.I107]<7; 2; 1)) -> 3 | AK107: 1 | AL107: 1 | AM107: 106
A108: Sadistic Saber-tooth | B108: U | C108: Creature | E108: Trophy: Draw 1 card. Each opponent must discard a card | G108: 7 | I108: of:=CEILING(([.F108]+[.G108]+[.H108]) * 0.5; 1) -> 4 | AE108: of:=IF([.W108]>0;[.AO$7]*[.W108];0)+IF([.W108]>0;[.AO$19];1)*IF([.R108]>0;[.R108];1)*IF([.AB108]=1;[.AB108]*[.AO$26];1)*(IF([.Z108]>0;[.AO$22];1)*([.J108]*[.AO$7]+[.K108]*[.AO$8]+[.L108]*[.AO$9]+[.N108]*[.AO$10]+[.O108]*[.AO$12]+[.P108]*[.AO$13]+[.S108]*[.AO$15]+[.T108]*[.AO$16]+[.U108]*[.AO$17]+[.V108]*[.AO$18]+[.X108]*[.AO$20])+[.Q108]*[.AO$14]+[.Y108]*[.AO$21]+[.AD108]*[.AO$27]) -> 0 | AF108: of:=[.AE108]+[.I108]-IF([.W108]>0;0;[.F108]+[.G108]+[.H108]) -> -3 | AG108: of:=[.AF108] -> -3 | AJ108: of:=IF([.I108]<5; 3; IF([.I108]<7; 2; 1)) -> 3 | AK108: 1 | AL108: 1 | AM108: 107
A109: Monstrous Mastodon | B109: U | C109: Creature | E109: Trophy: Return this to the Mastodon stack to deal 2 damage to any Fortification or Settlement | G109: 3 | I109: 1 | AE109: of:=IF([.W109]>0;[.AO$7]*[.W109];0)+IF([.W109]>0;[.AO$19];1)*IF([.R109]>0;[.R109];1)*IF([.AB109]=1;[.AB109]*[.AO$26];1)*(IF([.Z109]>0;[.AO$22];1)*([.J109]*[.AO$7]+[.K109]*[.AO$8]+[.L109]*[.AO$9]+[.N109]*[.AO$10]+[.O109]*[.AO$12]+[.P109]*[.AO$13]+[.S109]*[.AO$15]+[.T109]*[.AO$16]+[.U109]*[.AO$17]+[.V109]*[.AO$18]+[.X109]*[.AO$20])+[.Q109]*[.AO$14]+[.Y109]*[.AO$21]+[.AD109]*[.AO$27]) -> 0 | AF109: of:=[.AE109]+[.I109]-IF([.W109]>0;0;[.F109]+[.G109]+[.H109]) -> -2 | AG109: of:=[.AF109] -> -2 | AJ109: 16 | AL109: 1 | AM109: 108
A110: Harbinger Hawk | B110: U | C110: Creature | E110: Trophy: Draw 1 card or scrap 1 card in your hand or discard | I110: of:=CEILING(([.F110]+[.G110]+[.H110]) * 0.5; 1) -> 0 | AE110: of:=IF([.W110]>0;[.AO$7]*[.W110];0)+IF([.W110]>0;[.AO$19];1)*IF([.R110]>0;[.R110];1)*IF([.AB110]=1;[.AB110]*[.AO$26];1)*(IF([.Z110]>0;[.AO$22];1)*([.J110]*[.AO$7]+[.K110]*[.AO$8]+[.L110]*[.AO$9]+[.N110]*[.AO$10]+[.O110]*[.AO$12]+[.P110]*[.AO$13]+[.S110]*[.AO$15]+[.T110]*[.AO$16]+[.U110]*[.AO$17]+[.V110]*[.AO$18]+[.X110]*[.AO$20])+[.Q110]*[.AO$14]+[.Y110]*[.AO$21]+[.AD110]*[.AO$27]) -> 0 | AF110: of:=[.AE110]+[.I110]-IF([.W110]>0;0;[.F110]+[.G110]+[.H110]) -> 0 | AG110: of:=[.AF110] -> 0 | AJ110: of:=IF([.I110]<5; 3; IF([.I110]<7; 2; 1)) -> 3 | AK110: 1 | AL110: 1 | AM110: 109
B111: U | I111: of:=CEILING(([.F111]+[.G111]+[.H111]) * 0.5; 1) -> 0 | AE111: of:=IF([.W111]>0;[.AO$7]*[.W111];0)+IF([.W111]>0;[.AO$19];1)*IF([.R111]>0;[.R111];1)*IF([.AB111]=1;[.AB111]*[.AO$26];1)*(IF([.Z111]>0;[.AO$22];1)*([.J111]*[.AO$7]+[.K111]*[.AO$8]+[.L111]*[.AO$9]+[.N111]*[.AO$10]+[.O111]*[.AO$12]+[.P111]*[.AO$13]+[.S111]*[.AO$15]+[.T111]*[.AO$16]+[.U111]*[.AO$17]+[.V111]*[.AO$18]+[.X111]*[.AO$20])+[.Q111]*[.AO$14]+[.Y111]*[.AO$21]+[.AD111]*[.AO$27]) -> 0 | AF111: of:=[.AE111]+[.I111]-IF([.W111]>0;0;[.F111]+[.G111]+[.H111]) -> 0 | AG111: of:=[.AF111] -> 0 | AK111: 1 | AM111: 110
A112: Dastardly Dashers | B112: U | C112: Nomad | E112: Each opponent must either: discard a card or permanently lose 1 Anima | F112: 4 | G112: 4 | I112: of:=CEILING(([.F112]+[.G112]+[.H112]) * 0.5; 1) -> 4 | AE112: of:=IF([.W112]>0;[.AO$7]*[.W112];0)+IF([.W112]>0;[.AO$19];1)*IF([.R112]>0;[.R112];1)*IF([.AB112]=1;[.AB112]*[.AO$26];1)*(IF([.Z112]>0;[.AO$22];1)*([.J112]*[.AO$7]+[.K112]*[.AO$8]+[.L112]*[.AO$9]+[.N112]*[.AO$10]+[.O112]*[.AO$12]+[.P112]*[.AO$13]+[.S112]*[.AO$15]+[.T112]*[.AO$16]+[.U112]*[.AO$17]+[.V112]*[.AO$18]+[.X112]*[.AO$20])+[.Q112]*[.AO$14]+[.Y112]*[.AO$21]+[.AD112]*[.AO$27]) -> 0 | AF112: of:=[.AE112]+[.I112]-IF([.W112]>0;0;[.F112]+[.G112]+[.H112]) -> -4 | AG112: of:=[.AF112] -> -4 | AJ112: 1 | AK112: 1 | AM112: 111
A113: Optimistic Nihilists | B113: U | C113: Nomad | E113: Gain 3 Trade and permanently increase your Anima by 1 | F113: 7 | G113: 4 | I113: of:=CEILING(([.F113]+[.G113]+[.H113]) * 0.5; 1) -> 6 | K113: 3 | N113: 3 | AE113: of:=IF([.W113]>0;[.AO$7]*[.W113];0)+IF([.W113]>0;[.AO$19];1)*IF([.R113]>0;[.R113];1)*IF([.AB113]=1;[.AB113]*[.AO$26];1)*(IF([.Z113]>0;[.AO$22];1)*([.J113]*[.AO$7]+[.K113]*[.AO$8]+[.L113]*[.AO$9]+[.N113]*[.AO$10]+[.O113]*[.AO$12]+[.P113]*[.AO$13]+[.S113]*[.AO$15]+[.T113]*[.AO$16]+[.U113]*[.AO$17]+[.V113]*[.AO$18]+[.X113]*[.AO$20])+[.Q113]*[.AO$14]+[.Y113]*[.AO$21]+[.AD113]*[.AO$27]) -> 6 | AF113: of:=[.AE113]+[.I113]-IF([.W113]>0;0;[.F113]+[.G113]+[.H113]) -> 1 | AG113: of:=[.AF113] -> 1 | AJ113: 1 | AK113: 1 | AM113: 112
A114: Pessimistic Nihilists | B114: U | C114: Nomad | E114: Gain 3 Strength and permanently increase your Anima by 1 | F114: 4 | G114: 7 | I114: of:=CEILING(([.F114]+[.G114]+[.H114]) * 0.5; 1) -> 6 | L114: 3 | N114: 3 | AE114: of:=IF([.W114]>0;[.AO$7]*[.W114];0)+IF([.W114]>0;[.AO$19];1)*IF([.R114]>0;[.R114];1)*IF([.AB114]=1;[.AB114]*[.AO$26];1)*(IF([.Z114]>0;[.AO$22];1)*([.J114]*[.AO$7]+[.K114]*[.AO$8]+[.L114]*[.AO$9]+[.N114]*[.AO$10]+[.O114]*[.AO$12]+[.P114]*[.AO$13]+[.S114]*[.AO$15]+[.T114]*[.AO$16]+[.U114]*[.AO$17]+[.V114]*[.AO$18]+[.X114]*[.AO$20])+[.Q114]*[.AO$14]+[.Y114]*[.AO$21]+[.AD114]*[.AO$27]) -> 6 | AF114: of:=[.AE114]+[.I114]-IF([.W114]>0;0;[.F114]+[.G114]+[.H114]) -> 1 | AG114: of:=[.AF114] -> 1 | AJ114: 1 | AK114: 1 | AM114: 113
A115: Neutral Nihilists | B115: U | C115: Nomad | E115: Gain 2 Trade, 2 Strength, and permanently increase your Anima by 1 | F115: 6 | G115: 6 | I115: of:=CEILING(([.F115]+[.G115]+[.H115]) * 0.5; 1) -> 6 | K115: 2 | L115: 2 | N115: 2 | AE115: of:=IF([.W115]>0;[.AO$7]*[.W115];0)+IF([.W115]>0;[.AO$19];1)*IF([.R115]>0;[.R115];1)*IF([.AB115]=1;[.AB115]*[.AO$26];1)*(IF([.Z115]>0;[.AO$22];1)*([.J115]*[.AO$7]+[.K115]*[.AO$8]+[.L115]*[.AO$9]+[.N115]*[.AO$10]+[.O115]*[.AO$12]+[.P115]*[.AO$13]+[.S115]*[.AO$15]+[.T115]*[.AO$16]+[.U115]*[.AO$17]+[.V115]*[.AO$18]+[.X115]*[.AO$20])+[.Q115]*[.AO$14]+[.Y115]*[.AO$21]+[.AD115]*[.AO$27]) -> 6 | AF115: of:=[.AE115]+[.I115]-IF([.W115]>0;0;[.F115]+[.G115]+[.H115]) -> 0 | AG115: of:=[.AF115] -> 0 | AJ115: 1 | AK115: 1 | AM115: 114
B116: U | C116: Nomad | I116: of:=CEILING(([.F116]+[.G116]+[.H116]) * 0.5; 1) -> 0 | AE116: of:=IF([.W116]>0;[.AO$7]*[.W116];0)+IF([.W116]>0;[.AO$19];1)*IF([.R116]>0;[.R116];1)*IF([.AB116]=1;[.AB116]*[.AO$26];1)*(IF([.Z116]>0;[.AO$22];1)*([.J116]*[.AO$7]+[.K116]*[.AO$8]+[.L116]*[.AO$9]+[.N116]*[.AO$10]+[.O116]*[.AO$12]+[.P116]*[.AO$13]+[.S116]*[.AO$15]+[.T116]*[.AO$16]+[.U116]*[.AO$17]+[.V116]*[.AO$18]+[.X116]*[.AO$20])+[.Q116]*[.AO$14]+[.Y116]*[.AO$21]+[.AD116]*[.AO$27]) -> 0 | AF116: of:=[.AE116]+[.I116]-IF([.W116]>0;0;[.F116]+[.G116]+[.H116]) -> 0 | AG116: of:=[.AF116] -> 0 | AK116: 1 | AM116: 115
B117: U | C117: Nomad | I117: of:=CEILING(([.F117]+[.G117]+[.H117]) * 0.5; 1) -> 0 | AE117: of:=IF([.W117]>0;[.AO$7]*[.W117];0)+IF([.W117]>0;[.AO$19];1)*IF([.R117]>0;[.R117];1)*IF([.AB117]=1;[.AB117]*[.AO$26];1)*(IF([.Z117]>0;[.AO$22];1)*([.J117]*[.AO$7]+[.K117]*[.AO$8]+[.L117]*[.AO$9]+[.N117]*[.AO$10]+[.O117]*[.AO$12]+[.P117]*[.AO$13]+[.S117]*[.AO$15]+[.T117]*[.AO$16]+[.U117]*[.AO$17]+[.V117]*[.AO$18]+[.X117]*[.AO$20])+[.Q117]*[.AO$14]+[.Y117]*[.AO$21]+[.AD117]*[.AO$27]) -> 0 | AF117: of:=[.AE117]+[.I117]-IF([.W117]>0;0;[.F117]+[.G117]+[.H117]) -> 0 | AG117: of:=[.AF117] -> 0 | AK117: 1 | AM117: 116
B118: U | F118: 2 | H118: 6 | I118: of:=CEILING(([.F118]+[.G118]+[.H118]) * 0.5; 1) -> 4 | AE118: of:=IF([.W118]>0;[.AO$7]*[.W118];0)+IF([.W118]>0;[.AO$19];1)*IF([.R118]>0;[.R118];1)*IF([.AB118]=1;[.AB118]*[.AO$26];1)*(IF([.Z118]>0;[.AO$22];1)*([.J118]*[.AO$7]+[.K118]*[.AO$8]+[.L118]*[.AO$9]+[.N118]*[.AO$10]+[.O118]*[.AO$12]+[.P118]*[.AO$13]+[.S118]*[.AO$15]+[.T118]*[.AO$16]+[.U118]*[.AO$17]+[.V118]*[.AO$18]+[.X118]*[.AO$20])+[.Q118]*[.AO$14]+[.Y118]*[.AO$21]+[.AD118]*[.AO$27]) -> 0 | AF118: of:=[.AE118]+[.I118]-IF([.W118]>0;0;[.F118]+[.G118]+[.H118]) -> -4 | AG118: of:=[.AF118] -> -4 | AK118: 1 | AM118: 117
A119: Holy Handcrank | B119: U | C119: Relic | H119: 5 | I119: of:=CEILING(([.F119]+[.G119]+[.H119]) * 0.5; 1) -> 3 | AE119: of:=IF([.W119]>0;[.AO$7]*[.W119];0)+IF([.W119]>0;[.AO$19];1)*IF([.R119]>0;[.R119];1)*IF([.AB119]=1;[.AB119]*[.AO$26];1)*(IF([.Z119]>0;[.AO$22];1)*([.J119]*[.AO$7]+[.K119]*[.AO$8]+[.L119]*[.AO$9]+[.N119]*[.AO$10]+[.O119]*[.AO$12]+[.P119]*[.AO$13]+[.S119]*[.AO$15]+[.T119]*[.AO$16]+[.U119]*[.AO$17]+[.V119]*[.AO$18]+[.X119]*[.AO$20])+[.Q119]*[.AO$14]+[.Y119]*[.AO$21]+[.AD119]*[.AO$27]) -> 0 | AF119: of:=[.AE119]+[.I119]-IF([.W119]>0;0;[.F119]+[.G119]+[.H119]) -> -2 | AG119: of:=[.AF119] -> -2 | AK119: 1 | AM119: 118
A120: Teeth of St. Titania | B120: U | C120: Relic | I120: of:=CEILING(([.F120]+[.G120]+[.H120]) * 0.5; 1) -> 0 | AE120: of:=IF([.W120]>0;[.AO$7]*[.W120];0)+IF([.W120]>0;[.AO$19];1)*IF([.R120]>0;[.R120];1)*IF([.AB120]=1;[.AB120]*[.AO$26];1)*(IF([.Z120]>0;[.AO$22];1)*([.J120]*[.AO$7]+[.K120]*[.AO$8]+[.L120]*[.AO$9]+[.N120]*[.AO$10]+[.O120]*[.AO$12]+[.P120]*[.AO$13]+[.S120]*[.AO$15]+[.T120]*[.AO$16]+[.U120]*[.AO$17]+[.V120]*[.AO$18]+[.X120]*[.AO$20])+[.Q120]*[.AO$14]+[.Y120]*[.AO$21]+[.AD120]*[.AO$27]) -> 0 | AF120: of:=[.AE120]+[.I120]-IF([.W120]>0;0;[.F120]+[.G120]+[.H120]) -> 0 | AG120: of:=[.AF120] -> 0 | AK120: 1 | AM120: 119
A121: Ark of the Condemned | B121: U | C121: Relic | I121: of:=CEILING(([.F121]+[.G121]+[.H121]) * 0.5; 1) -> 0 | AE121: of:=IF([.W121]>0;[.AO$7]*[.W121];0)+IF([.W121]>0;[.AO$19];1)*IF([.R121]>0;[.R121];1)*IF([.AB121]=1;[.AB121]*[.AO$26];1)*(IF([.Z121]>0;[.AO$22];1)*([.J121]*[.AO$7]+[.K121]*[.AO$8]+[.L121]*[.AO$9]+[.N121]*[.AO$10]+[.O121]*[.AO$12]+[.P121]*[.AO$13]+[.S121]*[.AO$15]+[.T121]*[.AO$16]+[.U121]*[.AO$17]+[.V121]*[.AO$18]+[.X121]*[.AO$20])+[.Q121]*[.AO$14]+[.Y121]*[.AO$21]+[.AD121]*[.AO$27]) -> 0 | AF121: of:=[.AE121]+[.I121]-IF([.W121]>0;0;[.F121]+[.G121]+[.H121]) -> 0 | AG121: of:=[.AF121] -> 0 | AK121: 1 | AM121: 120
B122: U | C122: Relic | I122: of:=CEILING(([.F122]+[.G122]+[.H122]) * 0.5; 1) -> 0 | AE122: of:=IF([.W122]>0;[.AO$7]*[.W122];0)+IF([.W122]>0;[.AO$19];1)*IF([.R122]>0;[.R122];1)*IF([.AB122]=1;[.AB122]*[.AO$26];1)*(IF([.Z122]>0;[.AO$22];1)*([.J122]*[.AO$7]+[.K122]*[.AO$8]+[.L122]*[.AO$9]+[.N122]*[.AO$10]+[.O122]*[.AO$12]+[.P122]*[.AO$13]+[.S122]*[.AO$15]+[.T122]*[.AO$16]+[.U122]*[.AO$17]+[.V122]*[.AO$18]+[.X122]*[.AO$20])+[.Q122]*[.AO$14]+[.Y122]*[.AO$21]+[.AD122]*[.AO$27]) -> 0 | AF122: of:=[.AE122]+[.I122]-IF([.W122]>0;0;[.F122]+[.G122]+[.H122]) -> 0 | AG122: of:=[.AF122] -> 0 | AK122: 1 | AM122: 121
B123: U | C123: Relic | I123: of:=CEILING(([.F123]+[.G123]+[.H123]) * 0.5; 1) -> 0 | AE123: of:=IF([.W123]>0;[.AO$7]*[.W123];0)+IF([.W123]>0;[.AO$19];1)*IF([.R123]>0;[.R123];1)*IF([.AB123]=1;[.AB123]*[.AO$26];1)*(IF([.Z123]>0;[.AO$22];1)*([.J123]*[.AO$7]+[.K123]*[.AO$8]+[.L123]*[.AO$9]+[.N123]*[.AO$10]+[.O123]*[.AO$12]+[.P123]*[.AO$13]+[.S123]*[.AO$15]+[.T123]*[.AO$16]+[.U123]*[.AO$17]+[.V123]*[.AO$18]+[.X123]*[.AO$20])+[.Q123]*[.AO$14]+[.Y123]*[.AO$21]+[.AD123]*[.AO$27]) -> 0 | AF123: of:=[.AE123]+[.I123]-IF([.W123]>0;0;[.F123]+[.G123]+[.H123]) -> 0 | AG123: of:=[.AF123] -> 0 | AK123: 1 | AM123: 122
B124: U | C124: Relic | I124: of:=CEILING(([.F124]+[.G124]+[.H124]) * 0.5; 1) -> 0 | AE124: of:=IF([.W124]>0;[.AO$7]*[.W124];0)+IF([.W124]>0;[.AO$19];1)*IF([.R124]>0;[.R124];1)*IF([.AB124]=1;[.AB124]*[.AO$26];1)*(IF([.Z124]>0;[.AO$22];1)*([.J124]*[.AO$7]+[.K124]*[.AO$8]+[.L124]*[.AO$9]+[.N124]*[.AO$10]+[.O124]*[.AO$12]+[.P124]*[.AO$13]+[.S124]*[.AO$15]+[.T124]*[.AO$16]+[.U124]*[.AO$17]+[.V124]*[.AO$18]+[.X124]*[.AO$20])+[.Q124]*[.AO$14]+[.Y124]*[.AO$21]+[.AD124]*[.AO$27]) -> 0 | AF124: of:=[.AE124]+[.I124]-IF([.W124]>0;0;[.F124]+[.G124]+[.H124]) -> 0 | AG124: of:=[.AF124] -> 0 | AK124: 1 | AM124: 123
A125: Creature Statistics | AE125: of:=IF([.W125]>0;[.AO$7]*[.W125];0)+IF([.W125]>0;[.AO$19];1)*IF([.R125]>0;[.R125];1)*IF([.AB125]=1;[.AB125]*[.AO$26];1)*(IF([.Z125]>0;[.AO$22];1)*([.J125]*[.AO$7]+[.K125]*[.AO$8]+[.L125]*[.AO$9]+[.N125]*[.AO$10]+[.O125]*[.AO$12]+[.P125]*[.AO$13]+[.S125]*[.AO$15]+[.T125]*[.AO$16]+[.U125]*[.AO$17]+[.V125]*[.AO$18]+[.X125]*[.AO$20])+[.Q125]*[.AO$14]+[.Y125]*[.AO$21]+[.AD125]*[.AO$27]) -> 0 | AF125: of:=[.AE125]+[.I125]-IF([.W125]>0;0;[.F125]+[.G125]+[.H125]) -> 0 | AJ125: of:=SUM([.AJ99:.AJ124])-[.AJ109] -> 33 | AM125: 124
A126: Settlements | AE126: of:=IF([.W126]>0;[.AO$7]*[.W126];0)+IF([.W126]>0;[.AO$19];1)*IF([.R126]>0;[.R126];1)*IF([.AB126]=1;[.AB126]*[.AO$26];1)*(IF([.Z126]>0;[.AO$22];1)*([.J126]*[.AO$7]+[.K126]*[.AO$8]+[.L126]*[.AO$9]+[.N126]*[.AO$10]+[.O126]*[.AO$12]+[.P126]*[.AO$13]+[.S126]*[.AO$15]+[.T126]*[.AO$16]+[.U126]*[.AO$17]+[.V126]*[.AO$18]+[.X126]*[.AO$20])+[.Q126]*[.AO$14]+[.Y126]*[.AO$21]+[.AD126]*[.AO$27]) -> 0 | AF126: of:=[.AE126]+[.I126]-IF([.W126]>0;0;[.F126]+[.G126]+[.H126]) -> 0 | AM126: 125
A127: Lin | B127: U | C127: Settlement | E127: Starter. Use 2 Anima to heal a Settlement 2 Health. If that Settlement has less than 10 Health, heal 4 instead | J127: 2 | P127: 2 | Q127: 30 | AD127: 0.5 | AE127: of:=IF([.W127]>0;[.AO$7]*[.W127];0)+IF([.W127]>0;[.AO$19];1)*IF([.R127]>0;[.R127];1)*IF([.AB127]=1;[.AB127]*[.AO$26];1)*(IF([.Z127]>0;[.AO$22];1)*([.J127]*[.AO$7]+[.K127]*[.AO$8]+[.L127]*[.AO$9]+[.N127]*[.AO$10]+[.O127]*[.AO$12]+[.P127]*[.AO$13]+[.S127]*[.AO$15]+[.T127]*[.AO$16]+[.U127]*[.AO$17]+[.V127]*[.AO$18]+[.X127]*[.AO$20])+[.Q127]*[.AO$14]+[.Y127]*[.AO$21]+[.AD127]*[.AO$27]) -> 12.5 | AF127: of:=[.AE127]+[.I127]-IF([.W127]>0;0;[.F127]+[.G127]+[.H127]) -> 12.5 | AG127: of:=[.AF127] -> 12.5 | AJ127: 1 | AL127: 1 | AM127: 126
A128: Byblos | B128: U | C128: Settlement | E128: Starter. Use 2 Anima to heal a Settlement 2 Health. If that Settlement has less than 10 Health, heal 4 instead | J128: 2 | P128: 2 | Q128: 30 | AD128: 0.5 | AE128: of:=IF([.W128]>0;[.AO$7]*[.W128];0)+IF([.W128]>0;[.AO$19];1)*IF([.R128]>0;[.R128];1)*IF([.AB128]=1;[.AB128]*[.AO$26];1)*(IF([.Z128]>0;[.AO$22];1)*([.J128]*[.AO$7]+[.K128]*[.AO$8]+[.L128]*[.AO$9]+[.N128]*[.AO$10]+[.O128]*[.AO$12]+[.P128]*[.AO$13]+[.S128]*[.AO$15]+[.T128]*[.AO$16]+[.U128]*[.AO$17]+[.V128]*[.AO$18]+[.X128]*[.AO$20])+[.Q128]*[.AO$14]+[.Y128]*[.AO$21]+[.AD128]*[.AO$27]) -> 12.5 | AF128: of:=[.AE128]+[.I128]-IF([.W128]>0;0;[.F128]+[.G128]+[.H128]) -> 12.5 | AG128: of:=[.AF128] -> 12.5 | AJ128: 1 | AL128: 1 | AM128: 127
A129: Varanasi | B129: U | C129: Settlement | E129: Starter. Use 2 Anima to heal a Settlement 2 Health. If that Settlement has less than 10 Health, heal 4 instead | J129: 2 | P129: 2 | Q129: 30 | AD129: 0.5 | AE129: of:=IF([.W129]>0;[.AO$7]*[.W129];0)+IF([.W129]>0;[.AO$19];1)*IF([.R129]>0;[.R129];1)*IF([.AB129]=1;[.AB129]*[.AO$26];1)*(IF([.Z129]>0;[.AO$22];1)*([.J129]*[.AO$7]+[.K129]*[.AO$8]+[.L129]*[.AO$9]+[.N129]*[.AO$10]+[.O129]*[.AO$12]+[.P129]*[.AO$13]+[.S129]*[.AO$15]+[.T129]*[.AO$16]+[.U129]*[.AO$17]+[.V129]*[.AO$18]+[.X129]*[.AO$20])+[.Q129]*[.AO$14]+[.Y129]*[.AO$21]+[.AD129]*[.AO$27]) -> 12.5 | AF129: of:=[.AE129]+[.I129]-IF([.W129]>0;0;[.F129]+[.G129]+[.H129]) -> 12.5 | AG129: of:=[.AF129] -> 12.5 | AJ129: 1 | AL129: 1 | AM129: 128
A130: Sidon | B130: U | C130: Settlement | E130: Starter. Use 2 Anima to heal a Settlement 2 Health. If that Settlement has less than 10 Health, heal 4 instead | J130: 2 | P130: 2 | Q130: 30 | AD130: 0.5 | AE130: of:=IF([.W130]>0;[.AO$7]*[.W130];0)+IF([.W130]>0;[.AO$19];1)*IF([.R130]>0;[.R130];1)*IF([.AB130]=1;[.AB130]*[.AO$26];1)*(IF([.Z130]>0;[.AO$22];1)*([.J130]*[.AO$7]+[.K130]*[.AO$8]+[.L130]*[.AO$9]+[.N130]*[.AO$10]+[.O130]*[.AO$12]+[.P130]*[.AO$13]+[.S130]*[.AO$15]+[.T130]*[.AO$16]+[.U130]*[.AO$17]+[.V130]*[.AO$18]+[.X130]*[.AO$20])+[.Q130]*[.AO$14]+[.Y130]*[.AO$21]+[.AD130]*[.AO$27]) -> 12.5 | AF130: of:=[.AE130]+[.I130]-IF([.W130]>0;0;[.F130]+[.G130]+[.H130]) -> 12.5 | AG130: of:=[.AF130] -> 12.5 | AJ130: 1 | AL130: 1 | AM130: 129
A131: Rome | B131: U | C131: Settlement | E131: Use 4 Anima to gain 4 Trade | F131: 4 | G131: 6 | I131: 5 | J131: 4 | K131: 4 | Q131: 25 | AE131: of:=IF([.W131]>0;[.AO$7]*[.W131];0)+IF([.W131]>0;[.AO$19];1)*IF([.R131]>0;[.R131];1)*IF([.AB131]=1;[.AB131]*[.AO$26];1)*(IF([.Z131]>0;[.AO$22];1)*([.J131]*[.AO$7]+[.K131]*[.AO$8]+[.L131]*[.AO$9]+[.N131]*[.AO$10]+[.O131]*[.AO$12]+[.P131]*[.AO$13]+[.S131]*[.AO$15]+[.T131]*[.AO$16]+[.U131]*[.AO$17]+[.V131]*[.AO$18]+[.X131]*[.AO$20])+[.Q131]*[.AO$14]+[.Y131]*[.AO$21]+[.AD131]*[.AO$27]) -> 12 | AF131: of:=[.AE131]+[.I131]-IF([.W131]>0;0;[.F131]+[.G131]+[.H131]) -> 7 | AG131: of:=[.AF131] -> 7 | AJ131: 1 | AL131: 1 | AM131: 130
A132: Athens | B132: U | C132: Settlement | E132: Use 4 Anima to gain 5 Strength | F132: 6 | G132: 4 | I132: 5 | J132: 4 | L132: 5 | Q132: 25 | AE132: of:=IF([.W132]>0;[.AO$7]*[.W132];0)+IF([.W132]>0;[.AO$19];1)*IF([.R132]>0;[.R132];1)*IF([.AB132]=1;[.AB132]*[.AO$26];1)*(IF([.Z132]>0;[.AO$22];1)*([.J132]*[.AO$7]+[.K132]*[.AO$8]+[.L132]*[.AO$9]+[.N132]*[.AO$10]+[.O132]*[.AO$12]+[.P132]*[.AO$13]+[.S132]*[.AO$15]+[.T132]*[.AO$16]+[.U132]*[.AO$17]+[.V132]*[.AO$18]+[.X132]*[.AO$20])+[.Q132]*[.AO$14]+[.Y132]*[.AO$21]+[.AD132]*[.AO$27]) -> 13 | AF132: of:=[.AE132]+[.I132]-IF([.W132]>0;0;[.F132]+[.G132]+[.H132]) -> 8 | AG132: of:=[.AF132] -> 8 | AJ132: 1 | AL132: 1 | AM132: 131
A133: Luxor | B133: U | C133: Settlement | E133: Use 4 Anima to gain 3 Favor | F133: 5 | G133: 5 | I133: 5 | J133: 4 | O133: 3 | Q133: 25 | AE133: of:=IF([.W133]>0;[.AO$7]*[.W133];0)+IF([.W133]>0;[.AO$19];1)*IF([.R133]>0;[.R133];1)*IF([.AB133]=1;[.AB133]*[.AO$26];1)*(IF([.Z133]>0;[.AO$22];1)*([.J133]*[.AO$7]+[.K133]*[.AO$8]+[.L133]*[.AO$9]+[.N133]*[.AO$10]+[.O133]*[.AO$12]+[.P133]*[.AO$13]+[.S133]*[.AO$15]+[.T133]*[.AO$16]+[.U133]*[.AO$17]+[.V133]*[.AO$18]+[.X133]*[.AO$20])+[.Q133]*[.AO$14]+[.Y133]*[.AO$21]+[.AD133]*[.AO$27]) -> 9.2 | AF133: of:=[.AE133]+[.I133]-IF([.W133]>0;0;[.F133]+[.G133]+[.H133]) -> 4.2 | AG133: of:=[.AF133] -> 4.2 | AJ133: 1 | AL133: 1 | AM133: 132
A134: Alexandria | B134: U | C134: Settlement | E134: Use 4 Anima to draw 2 cards | F134: 5 | G134: 5 | I134: 5 | J134: 4 | Q134: 25 | U134: 2 | AE134: of:=IF([.W134]>0;[.AO$7]*[.W134];0)+IF([.W134]>0;[.AO$19];1)*IF([.R134]>0;[.R134];1)*IF([.AB134]=1;[.AB134]*[.AO$26];1)*(IF([.Z134]>0;[.AO$22];1)*([.J134]*[.AO$7]+[.K134]*[.AO$8]+[.L134]*[.AO$9]+[.N134]*[.AO$10]+[.O134]*[.AO$12]+[.P134]*[.AO$13]+[.S134]*[.AO$15]+[.T134]*[.AO$16]+[.U134]*[.AO$17]+[.V134]*[.AO$18]+[.X134]*[.AO$20])+[.Q134]*[.AO$14]+[.Y134]*[.AO$21]+[.AD134]*[.AO$27]) -> 9.6 | AF134: of:=[.AE134]+[.I134]-IF([.W134]>0;0;[.F134]+[.G134]+[.H134]) -> 4.6 | AG134: of:=[.AF134] -> 4.6 | AJ134: 1 | AL134: 1 | AM134: 133
A135: Faiyum | B135: U | C135: Settlement | E135: Use 3 Anima to gain 3 Trade | I135: 7 | J135: 3 | K135: 3 | Q135: 25 | AE135: of:=IF([.W135]>0;[.AO$7]*[.W135];0)+IF([.W135]>0;[.AO$19];1)*IF([.R135]>0;[.R135];1)*IF([.AB135]=1;[.AB135]*[.AO$26];1)*(IF([.Z135]>0;[.AO$22];1)*([.J135]*[.AO$7]+[.K135]*[.AO$8]+[.L135]*[.AO$9]+[.N135]*[.AO$10]+[.O135]*[.AO$12]+[.P135]*[.AO$13]+[.S135]*[.AO$15]+[.T135]*[.AO$16]+[.U135]*[.AO$17]+[.V135]*[.AO$18]+[.X135]*[.AO$20])+[.Q135]*[.AO$14]+[.Y135]*[.AO$21]+[.AD135]*[.AO$27]) -> 11.5 | AF135: of:=[.AE135]+[.I135]-IF([.W135]>0;0;[.F135]+[.G135]+[.H135]) -> 18.5 | AG135: of:=[.AF135] -> 18.5 | AJ135: 1 | AL135: 1 | AM135: 134
A136: Ephesus | B136: U | C136: Settlement | E136: Use 3 Anima to gain 4 Strength | I136: 7 | J136: 3 | L136: 4 | Q136: 25 | AE136: of:=IF([.W136]>0;[.AO$7]*[.W136];0)+IF([.W136]>0;[.AO$19];1)*IF([.R136]>0;[.R136];1)*IF([.AB136]=1;[.AB136]*[.AO$26];1)*(IF([.Z136]>0;[.AO$22];1)*([.J136]*[.AO$7]+[.K136]*[.AO$8]+[.L136]*[.AO$9]+[.N136]*[.AO$10]+[.O136]*[.AO$12]+[.P136]*[.AO$13]+[.S136]*[.AO$15]+[.T136]*[.AO$16]+[.U136]*[.AO$17]+[.V136]*[.AO$18]+[.X136]*[.AO$20])+[.Q136]*[.AO$14]+[.Y136]*[.AO$21]+[.AD136]*[.AO$27]) -> 12.5 | AF136: of:=[.AE136]+[.I136]-IF([.W136]>0;0;[.F136]+[.G136]+[.H136]) -> 19.5 | AG136: of:=[.AF136] -> 19.5 | AJ136: 1 | AL136: 1 | AM136: 135
A137: Aleppo | B137: U | C137: Settlement | E137: Use 3 Anima to gain 2 Favor | I137: 7 | J137: 3 | O137: 2 | Q137: 25 | AE137: of:=IF([.W137]>0;[.AO$7]*[.W137];0)+IF([.W137]>0;[.AO$19];1)*IF([.R137]>0;[.R137];1)*IF([.AB137]=1;[.AB137]*[.AO$26];1)*(IF([.Z137]>0;[.AO$22];1)*([.J137]*[.AO$7]+[.K137]*[.AO$8]+[.L137]*[.AO$9]+[.N137]*[.AO$10]+[.O137]*[.AO$12]+[.P137]*[.AO$13]+[.S137]*[.AO$15]+[.T137]*[.AO$16]+[.U137]*[.AO$17]+[.V137]*[.AO$18]+[.X137]*[.AO$20])+[.Q137]*[.AO$14]+[.Y137]*[.AO$21]+[.AD137]*[.AO$27]) -> 9.3 | AF137: of:=[.AE137]+[.I137]-IF([.W137]>0;0;[.F137]+[.G137]+[.H137]) -> 16.3 | AG137: of:=[.AF137] -> 16.3 | AJ137: 1 | AL137: 1 | AM137: 136
A138: Beirut | B138: U | C138: Settlement | E138: Use 3 Anima to draw 1 card | I138: 7 | J138: 3 | Q138: 25 | U138: 1 | AE138: of:=IF([.W138]>0;[.AO$7]*[.W138];0)+IF([.W138]>0;[.AO$19];1)*IF([.R138]>0;[.R138];1)*IF([.AB138]=1;[.AB138]*[.AO$26];1)*(IF([.Z138]>0;[.AO$22];1)*([.J138]*[.AO$7]+[.K138]*[.AO$8]+[.L138]*[.AO$9]+[.N138]*[.AO$10]+[.O138]*[.AO$12]+[.P138]*[.AO$13]+[.S138]*[.AO$15]+[.T138]*[.AO$16]+[.U138]*[.AO$17]+[.V138]*[.AO$18]+[.X138]*[.AO$20])+[.Q138]*[.AO$14]+[.Y138]*[.AO$21]+[.AD138]*[.AO$27]) -> 9.3 | AF138: of:=[.AE138]+[.I138]-IF([.W138]>0;0;[.F138]+[.G138]+[.H138]) -> 16.3 | AG138: of:=[.AF138] -> 16.3 | AJ138: 1 | AL138: 1 | AM138: 137
A139: Ujjain | B139: U | C139: Settlement | E139: Use 2 Anima to gain 2 Trade | I139: 9 | J139: 2 | K139: 2 | Q139: 25 | AE139: of:=IF([.W139]>0;[.AO$7]*[.W139];0)+IF([.W139]>0;[.AO$19];1)*IF([.R139]>0;[.R139];1)*IF([.AB139]=1;[.AB139]*[.AO$26];1)*(IF([.Z139]>0;[.AO$22];1)*([.J139]*[.AO$7]+[.K139]*[.AO$8]+[.L139]*[.AO$9]+[.N139]*[.AO$10]+[.O139]*[.AO$12]+[.P139]*[.AO$13]+[.S139]*[.AO$15]+[.T139]*[.AO$16]+[.U139]*[.AO$17]+[.V139]*[.AO$18]+[.X139]*[.AO$20])+[.Q139]*[.AO$14]+[.Y139]*[.AO$21]+[.AD139]*[.AO$27]) -> 11 | AF139: of:=[.AE139]+[.I139]-IF([.W139]>0;0;[.F139]+[.G139]+[.H139]) -> 20 | AG139: of:=[.AF139] -> 20 | AJ139: 1 | AL139: 1 | AM139: 138
A140: Mitilini | B140: U | C140: Settlement | E140: Use 2 Anima to gain 3 Strength | I140: 9 | J140: 2 | L140: 3 | Q140: 25 | AE140: of:=IF([.W140]>0;[.AO$7]*[.W140];0)+IF([.W140]>0;[.AO$19];1)*IF([.R140]>0;[.R140];1)*IF([.AB140]=1;[.AB140]*[.AO$26];1)*(IF([.Z140]>0;[.AO$22];1)*([.J140]*[.AO$7]+[.K140]*[.AO$8]+[.L140]*[.AO$9]+[.N140]*[.AO$10]+[.O140]*[.AO$12]+[.P140]*[.AO$13]+[.S140]*[.AO$15]+[.T140]*[.AO$16]+[.U140]*[.AO$17]+[.V140]*[.AO$18]+[.X140]*[.AO$20])+[.Q140]*[.AO$14]+[.Y140]*[.AO$21]+[.AD140]*[.AO$27]) -> 12 | AF140: of:=[.AE140]+[.I140]-IF([.W140]>0;0;[.F140]+[.G140]+[.H140]) -> 21 | AG140: of:=[.AF140] -> 21 | AJ140: 1 | AL140: 1 | AM140: 139
A141: Istanbul | B141: U | C141: Settlement | E141: Use 2 Anima to gain 1 Favor | I141: 9 | J141: 2 | O141: 1 | Q141: 25 | AE141: of:=IF([.W141]>0;[.AO$7]*[.W141];0)+IF([.W141]>0;[.AO$19];1)*IF([.R141]>0;[.R141];1)*IF([.AB141]=1;[.AB141]*[.AO$26];1)*(IF([.Z141]>0;[.AO$22];1)*([.J141]*[.AO$7]+[.K141]*[.AO$8]+[.L141]*[.AO$9]+[.N141]*[.AO$10]+[.O141]*[.AO$12]+[.P141]*[.AO$13]+[.S141]*[.AO$15]+[.T141]*[.AO$16]+[.U141]*[.AO$17]+[.V141]*[.AO$18]+[.X141]*[.AO$20])+[.Q141]*[.AO$14]+[.Y141]*[.AO$21]+[.AD141]*[.AO$27]) -> 9.4 | AF141: of:=[.AE141]+[.I141]-IF([.W141]>0;0;[.F141]+[.G141]+[.H141]) -> 18.4 | AG141: of:=[.AF141] -> 18.4 | AJ141: 1 | AL141: 1 | AM141: 140
A142: Gaza | B142: U | C142: Settlement | E142: Use 2 Anima to heal any Building, Settlement, or Fortification 2 Health | I142: 9 | J142: 2 | P142: 2 | Q142: 25 | AE142: of:=IF([.W142]>0;[.AO$7]*[.W142];0)+IF([.W142]>0;[.AO$19];1)*IF([.R142]>0;[.R142];1)*IF([.AB142]=1;[.AB142]*[.AO$26];1)*(IF([.Z142]>0;[.AO$22];1)*([.J142]*[.AO$7]+[.K142]*[.AO$8]+[.L142]*[.AO$9]+[.N142]*[.AO$10]+[.O142]*[.AO$12]+[.P142]*[.AO$13]+[.S142]*[.AO$15]+[.T142]*[.AO$16]+[.U142]*[.AO$17]+[.V142]*[.AO$18]+[.X142]*[.AO$20])+[.Q142]*[.AO$14]+[.Y142]*[.AO$21]+[.AD142]*[.AO$27]) -> 10 | AF142: of:=[.AE142]+[.I142]-IF([.W142]>0;0;[.F142]+[.G142]+[.H142]) -> 19 | AG142: of:=[.AF142] -> 19 | AJ142: 1 | AL142: 1 | AM142: 141
A143: Balkh | B143: U | C143: Settlement | E143: Use 2 Anima to gain 2 Trade or 2 Strength | I143: 11 | J143: 2 | Q143: 25 | Z143: 1 | AE143: of:=IF([.W143]>0;[.AO$7]*[.W143];0)+IF([.W143]>0;[.AO$19];1)*IF([.R143]>0;[.R143];1)*IF([.AB143]=1;[.AB143]*[.AO$26];1)*(IF([.Z143]>0;[.AO$22];1)*([.J143]*[.AO$7]+[.K143]*[.AO$8]+[.L143]*[.AO$9]+[.N143]*[.AO$10]+[.O143]*[.AO$12]+[.P143]*[.AO$13]+[.S143]*[.AO$15]+[.T143]*[.AO$16]+[.U143]*[.AO$17]+[.V143]*[.AO$18]+[.X143]*[.AO$20])+[.Q143]*[.AO$14]+[.Y143]*[.AO$21]+[.AD143]*[.AO$27]) -> 9.4 | AF143: of:=[.AE143]+[.I143]-IF([.W143]>0;0;[.F143]+[.G143]+[.H143]) -> 20.4 | AG143: of:=[.AF143] -> 20.4 | AJ143: 1 | AL143: 1 | AM143: 142
A144: Memphis | B144: U | C144: Settlement | E144: Use 2 Anima to gain 1 Favor or draw 1 card | I144: 11 | J144: 2 | Q144: 25 | U144: 1 | Z144: 1 | AE144: of:=IF([.W144]>0;[.AO$7]*[.W144];0)+IF([.W144]>0;[.AO$19];1)*IF([.R144]>0;[.R144];1)*IF([.AB144]=1;[.AB144]*[.AO$26];1)*(IF([.Z144]>0;[.AO$22];1)*([.J144]*[.AO$7]+[.K144]*[.AO$8]+[.L144]*[.AO$9]+[.N144]*[.AO$10]+[.O144]*[.AO$12]+[.P144]*[.AO$13]+[.S144]*[.AO$15]+[.T144]*[.AO$16]+[.U144]*[.AO$17]+[.V144]*[.AO$18]+[.X144]*[.AO$20])+[.Q144]*[.AO$14]+[.Y144]*[.AO$21]+[.AD144]*[.AO$27]) -> 9.88 | AF144: of:=[.AE144]+[.I144]-IF([.W144]>0;0;[.F144]+[.G144]+[.H144]) -> 20.88 | AG144: of:=[.AF144] -> 20.88 | AJ144: 1 | AL144: 1 | AM144: 143
A145: Total Deck Statistics | AJ145: of:=[.AJ20]+[.AJ38]+[.AJ55]+[.AJ68]+[.AJ125] -> 125 | AM145: 144
AM146: 145
AM147: 146
AM148: 147
AM149: 148
AM150: 149
AM151: 150
AM152: 151
AM153: 152
AM154: 153
AM155: 154
AM156: 155
AM157: 156
AM158: 158
AM159: 159
AM160: 160
AM161: 161
AM162: 162
AM163: 163
AM164: 164
AM165: 165
AM166: 166
AM167: 167
AM168: 168
AM169: 169
AM170: 170